BATCH_ID,BATCH_UUID,DOCUMENT_UUID,FILE_UUID,TEXT_UUID,TEXT_ID,ROW_ID,SECTION,TEXT,LABEL,LABEL2,LABEL3,COMMENTS,ANNOTATOR_ID,TASK,TIMESTAMP_DELIVERED_TO_VENDOR,TIMESTAMP_VENDOR_DELIVERY,DOCUMENT_TYPE,SECTOR,SOURCE_DOCUMENT_URI
eb06640f608eb9bf90843728e9ee293c67bdaa68,eb06640f608eb9bf90843728e9ee293c67bdaa68,3aeaee5ee67a0e8aa824405567bee5c229b4f343,3aeaee5ee67a0e8aa824405567bee5c229b4f343,3aeaee5ee67a0e8aa824405567bee5c229b4f343_95,Q3_2012_O`Reilly_Automotive_Earnings_Conference_Call_95,95,presentation,"As a result, in difficult macro sales environments, we can't make immediate, significant changes to our SG&A structure without negatively impacting service levels.",,,,,,sentence-level event detection,2021-05-26_10:11:22,,earnings call transcript,various,Q3_2012_O`Reilly_Automotive_Earnings_Conference_Call
eb06640f608eb9bf90843728e9ee293c67bdaa68,eb06640f608eb9bf90843728e9ee293c67bdaa68,3aeaee5ee67a0e8aa824405567bee5c229b4f343,3aeaee5ee67a0e8aa824405567bee5c229b4f343,3aeaee5ee67a0e8aa824405567bee5c229b4f343_96,Q3_2012_O`Reilly_Automotive_Earnings_Conference_Call_96,96,presentation,"However, we do make well thought-out adjustments to our SG&A to ensure we react to sustain sales trend, but always keeping the focus on maintaining our long-term profitable growth.",,,,,,sentence-level event detection,2021-05-26_10:11:22,,earnings call transcript,various,Q3_2012_O`Reilly_Automotive_Earnings_Conference_Call
eb06640f608eb9bf90843728e9ee293c67bdaa68,eb06640f608eb9bf90843728e9ee293c67bdaa68,3aeaee5ee67a0e8aa824405567bee5c229b4f343,3aeaee5ee67a0e8aa824405567bee5c229b4f343,3aeaee5ee67a0e8aa824405567bee5c229b4f343_97,Q3_2012_O`Reilly_Automotive_Earnings_Conference_Call_97,97,presentation,"Our third-quarter results shows our ability to over time adjust our SG&A while protecting sales, as we deleveraged by only 43-basis points on a soft 1.3% comparable-store sales growth.",,,,,,sentence-level event detection,2021-05-26_10:11:22,,earnings call transcript,various,Q3_2012_O`Reilly_Automotive_Earnings_Conference_Call
eb06640f608eb9bf90843728e9ee293c67bdaa68,eb06640f608eb9bf90843728e9ee293c67bdaa68,3aeaee5ee67a0e8aa824405567bee5c229b4f343,3aeaee5ee67a0e8aa824405567bee5c229b4f343,3aeaee5ee67a0e8aa824405567bee5c229b4f343_98,Q3_2012_O`Reilly_Automotive_Earnings_Conference_Call_98,98,presentation,"For the first six months of 2012, our SG&A per store had increased to 2.8% over the prior year.",,,,,,sentence-level event detection,2021-05-26_10:11:22,,earnings call transcript,various,Q3_2012_O`Reilly_Automotive_Earnings_Conference_Call
eb06640f608eb9bf90843728e9ee293c67bdaa68,eb06640f608eb9bf90843728e9ee293c67bdaa68,3aeaee5ee67a0e8aa824405567bee5c229b4f343,3aeaee5ee67a0e8aa824405567bee5c229b4f343,3aeaee5ee67a0e8aa824405567bee5c229b4f343_99,Q3_2012_O`Reilly_Automotive_Earnings_Conference_Call_99,99,presentation,"However, through store-by-store adjustments to payroll and adjustments to our advertising spend, we are able to decrease the year-over-year increase to 2% at the end of the third quarter.",,,,,,sentence-level event detection,2021-05-26_10:11:22,,earnings call transcript,various,Q3_2012_O`Reilly_Automotive_Earnings_Conference_Call
eb06640f608eb9bf90843728e9ee293c67bdaa68,eb06640f608eb9bf90843728e9ee293c67bdaa68,3aeaee5ee67a0e8aa824405567bee5c229b4f343,3aeaee5ee67a0e8aa824405567bee5c229b4f343,3aeaee5ee67a0e8aa824405567bee5c229b4f343_100,Q3_2012_O`Reilly_Automotive_Earnings_Conference_Call_100,100,presentation,"Our single largest controllable expense is store payroll and we continue to focus on staffing each store with the right people at the right time in order to deliver top-notch customer service and grow the Business, while at the same time reacting to the slower sales environment.",,,,,,sentence-level event detection,2021-05-26_10:11:22,,earnings call transcript,various,Q3_2012_O`Reilly_Automotive_Earnings_Conference_Call
eb06640f608eb9bf90843728e9ee293c67bdaa68,eb06640f608eb9bf90843728e9ee293c67bdaa68,3aeaee5ee67a0e8aa824405567bee5c229b4f343,3aeaee5ee67a0e8aa824405567bee5c229b4f343,3aeaee5ee67a0e8aa824405567bee5c229b4f343_101,Q3_2012_O`Reilly_Automotive_Earnings_Conference_Call_101,101,presentation,Our store staffing and leadership remains the key priority for the O'Reilly store management team.,,,,,,sentence-level event detection,2021-05-26_10:11:22,,earnings call transcript,various,Q3_2012_O`Reilly_Automotive_Earnings_Conference_Call
eb06640f608eb9bf90843728e9ee293c67bdaa68,eb06640f608eb9bf90843728e9ee293c67bdaa68,3aeaee5ee67a0e8aa824405567bee5c229b4f343,3aeaee5ee67a0e8aa824405567bee5c229b4f343,3aeaee5ee67a0e8aa824405567bee5c229b4f343_102,Q3_2012_O`Reilly_Automotive_Earnings_Conference_Call_102,102,presentation,"Our regional and district managers continually work on training and building our store teams and making sure that we have the right leadership in the stores, not only during the day, but also on nights and weekends.",,,,,,sentence-level event detection,2021-05-26_10:11:22,,earnings call transcript,various,Q3_2012_O`Reilly_Automotive_Earnings_Conference_Call
eb06640f608eb9bf90843728e9ee293c67bdaa68,eb06640f608eb9bf90843728e9ee293c67bdaa68,3aeaee5ee67a0e8aa824405567bee5c229b4f343,3aeaee5ee67a0e8aa824405567bee5c229b4f343,3aeaee5ee67a0e8aa824405567bee5c229b4f343_103,Q3_2012_O`Reilly_Automotive_Earnings_Conference_Call_103,103,presentation,"Our focus is on superior execution at every store, every day.",,,,,,sentence-level event detection,2021-05-26_10:11:22,,earnings call transcript,various,Q3_2012_O`Reilly_Automotive_Earnings_Conference_Call
eb06640f608eb9bf90843728e9ee293c67bdaa68,eb06640f608eb9bf90843728e9ee293c67bdaa68,3aeaee5ee67a0e8aa824405567bee5c229b4f343,3aeaee5ee67a0e8aa824405567bee5c229b4f343,3aeaee5ee67a0e8aa824405567bee5c229b4f343_104,Q3_2012_O`Reilly_Automotive_Earnings_Conference_Call_104,104,presentation,"In early September, we hosted our annual regional manager's meeting.",,,,,,sentence-level event detection,2021-05-26_10:11:22,,earnings call transcript,various,Q3_2012_O`Reilly_Automotive_Earnings_Conference_Call
eb06640f608eb9bf90843728e9ee293c67bdaa68,eb06640f608eb9bf90843728e9ee293c67bdaa68,3aeaee5ee67a0e8aa824405567bee5c229b4f343,3aeaee5ee67a0e8aa824405567bee5c229b4f343,3aeaee5ee67a0e8aa824405567bee5c229b4f343_105,Q3_2012_O`Reilly_Automotive_Earnings_Conference_Call_105,105,presentation,"During the meetings with our regional managers, the main topic of the conversation centered around the idea that every region and every district around the country has opportunities for improvement, that we needed to concentrate our efforts on improving the performance on the bottom 20% of our stores in every district, in every region.",,,,,,sentence-level event detection,2021-05-26_10:11:22,,earnings call transcript,various,Q3_2012_O`Reilly_Automotive_Earnings_Conference_Call
eb06640f608eb9bf90843728e9ee293c67bdaa68,eb06640f608eb9bf90843728e9ee293c67bdaa68,3aeaee5ee67a0e8aa824405567bee5c229b4f343,3aeaee5ee67a0e8aa824405567bee5c229b4f343,3aeaee5ee67a0e8aa824405567bee5c229b4f343_106,Q3_2012_O`Reilly_Automotive_Earnings_Conference_Call_106,106,presentation,Our focus in these stores needs to be consistent execution of our proven business model.,,,,,,sentence-level event detection,2021-05-26_10:11:22,,earnings call transcript,various,Q3_2012_O`Reilly_Automotive_Earnings_Conference_Call
eb06640f608eb9bf90843728e9ee293c67bdaa68,eb06640f608eb9bf90843728e9ee293c67bdaa68,3aeaee5ee67a0e8aa824405567bee5c229b4f343,3aeaee5ee67a0e8aa824405567bee5c229b4f343,3aeaee5ee67a0e8aa824405567bee5c229b4f343_107,Q3_2012_O`Reilly_Automotive_Earnings_Conference_Call_107,107,presentation,"Understanding that every region has stores which outperform the others, it is apparent that the success of those stores is a result of having great store leadership and consistent superior customer service.",,,,,,sentence-level event detection,2021-05-26_10:11:22,,earnings call transcript,various,Q3_2012_O`Reilly_Automotive_Earnings_Conference_Call
eb06640f608eb9bf90843728e9ee293c67bdaa68,eb06640f608eb9bf90843728e9ee293c67bdaa68,3aeaee5ee67a0e8aa824405567bee5c229b4f343,3aeaee5ee67a0e8aa824405567bee5c229b4f343,3aeaee5ee67a0e8aa824405567bee5c229b4f343_108,Q3_2012_O`Reilly_Automotive_Earnings_Conference_Call_108,108,presentation,"We have tasked and challenged our regional managers with improving the leadership and the customer service of these underperforming stores in their regions, and by improving the performance of these stores one by one, we will see solid impact on our Company-wide performance.",,,,,,sentence-level event detection,2021-05-26_10:11:22,,earnings call transcript,various,Q3_2012_O`Reilly_Automotive_Earnings_Conference_Call
eb06640f608eb9bf90843728e9ee293c67bdaa68,eb06640f608eb9bf90843728e9ee293c67bdaa68,3aeaee5ee67a0e8aa824405567bee5c229b4f343,3aeaee5ee67a0e8aa824405567bee5c229b4f343,3aeaee5ee67a0e8aa824405567bee5c229b4f343_109,Q3_2012_O`Reilly_Automotive_Earnings_Conference_Call_109,109,presentation,"Another important focus of the regional manager's meeting was the execution of an effective, professional customer sales call program.",,,,,,sentence-level event detection,2021-05-26_10:11:22,,earnings call transcript,various,Q3_2012_O`Reilly_Automotive_Earnings_Conference_Call
eb06640f608eb9bf90843728e9ee293c67bdaa68,eb06640f608eb9bf90843728e9ee293c67bdaa68,3aeaee5ee67a0e8aa824405567bee5c229b4f343,3aeaee5ee67a0e8aa824405567bee5c229b4f343,3aeaee5ee67a0e8aa824405567bee5c229b4f343_110,Q3_2012_O`Reilly_Automotive_Earnings_Conference_Call_110,110,presentation,"Currently, the O'Reilly sales team consists of over 500 full-time dedicated territory sales managers and in addition, every store has a trained sales specialist that assigned a weekly call schedule on a part-time basis.",,,,,,sentence-level event detection,2021-05-26_10:11:22,,earnings call transcript,various,Q3_2012_O`Reilly_Automotive_Earnings_Conference_Call
eb06640f608eb9bf90843728e9ee293c67bdaa68,eb06640f608eb9bf90843728e9ee293c67bdaa68,3aeaee5ee67a0e8aa824405567bee5c229b4f343,3aeaee5ee67a0e8aa824405567bee5c229b4f343,3aeaee5ee67a0e8aa824405567bee5c229b4f343_111,Q3_2012_O`Reilly_Automotive_Earnings_Conference_Call_111,111,presentation,"Our goal for our 4,500-plus O'Reilly sales team is to make quality sales calls, to build strong relationships with every professional customer in their individual markets and become the first call for their business.",,,,,,sentence-level event detection,2021-05-26_10:11:22,,earnings call transcript,various,Q3_2012_O`Reilly_Automotive_Earnings_Conference_Call
eb06640f608eb9bf90843728e9ee293c67bdaa68,eb06640f608eb9bf90843728e9ee293c67bdaa68,3aeaee5ee67a0e8aa824405567bee5c229b4f343,3aeaee5ee67a0e8aa824405567bee5c229b4f343,3aeaee5ee67a0e8aa824405567bee5c229b4f343_112,Q3_2012_O`Reilly_Automotive_Earnings_Conference_Call_112,112,presentation,Another area where we have the ability to control our expenses in the short term is advertising.,,,,,,sentence-level event detection,2021-05-26_10:11:22,,earnings call transcript,various,Q3_2012_O`Reilly_Automotive_Earnings_Conference_Call
eb06640f608eb9bf90843728e9ee293c67bdaa68,eb06640f608eb9bf90843728e9ee293c67bdaa68,3aeaee5ee67a0e8aa824405567bee5c229b4f343,3aeaee5ee67a0e8aa824405567bee5c229b4f343,3aeaee5ee67a0e8aa824405567bee5c229b4f343_113,Q3_2012_O`Reilly_Automotive_Earnings_Conference_Call_113,113,presentation,"We continue to focus our advertising and marketing spend on print and radio, with targeted promotions to drive traffic into our stores and build O'Reilly brand awareness.",,,,,,sentence-level event detection,2021-05-26_10:11:22,,earnings call transcript,various,Q3_2012_O`Reilly_Automotive_Earnings_Conference_Call
eb06640f608eb9bf90843728e9ee293c67bdaa68,eb06640f608eb9bf90843728e9ee293c67bdaa68,3aeaee5ee67a0e8aa824405567bee5c229b4f343,3aeaee5ee67a0e8aa824405567bee5c229b4f343,3aeaee5ee67a0e8aa824405567bee5c229b4f343_114,Q3_2012_O`Reilly_Automotive_Earnings_Conference_Call_114,114,presentation,"However, during the quarter and for the remainder of the year, we closely scrutinize our advertising spend and opted to pull back on some of our non-core advertising programs.",,,,,,sentence-level event detection,2021-05-26_10:11:22,,earnings call transcript,various,Q3_2012_O`Reilly_Automotive_Earnings_Conference_Call
eb06640f608eb9bf90843728e9ee293c67bdaa68,eb06640f608eb9bf90843728e9ee293c67bdaa68,3aeaee5ee67a0e8aa824405567bee5c229b4f343,3aeaee5ee67a0e8aa824405567bee5c229b4f343,3aeaee5ee67a0e8aa824405567bee5c229b4f343_115,Q3_2012_O`Reilly_Automotive_Earnings_Conference_Call_115,115,presentation,"As we did in the second quarter, we ran call-to-action theme promotional events with the intentions to drive traffic into our store.",,,,,,sentence-level event detection,2021-05-26_10:11:22,,earnings call transcript,various,Q3_2012_O`Reilly_Automotive_Earnings_Conference_Call
eb06640f608eb9bf90843728e9ee293c67bdaa68,eb06640f608eb9bf90843728e9ee293c67bdaa68,3aeaee5ee67a0e8aa824405567bee5c229b4f343,3aeaee5ee67a0e8aa824405567bee5c229b4f343,3aeaee5ee67a0e8aa824405567bee5c229b4f343_116,Q3_2012_O`Reilly_Automotive_Earnings_Conference_Call_116,116,presentation,"When a customer comes into the store, our team member's responsibility is to provide them with exceptional customer service, offer them related sale items, and pursue upsell opportunities.",,,,,,sentence-level event detection,2021-05-26_10:11:22,,earnings call transcript,various,Q3_2012_O`Reilly_Automotive_Earnings_Conference_Call
eb06640f608eb9bf90843728e9ee293c67bdaa68,eb06640f608eb9bf90843728e9ee293c67bdaa68,3aeaee5ee67a0e8aa824405567bee5c229b4f343,3aeaee5ee67a0e8aa824405567bee5c229b4f343,3aeaee5ee67a0e8aa824405567bee5c229b4f343_117,Q3_2012_O`Reilly_Automotive_Earnings_Conference_Call_117,117,presentation,"The goal of these call-to-action events is to generate foot traffic into the store and create a positive customer interaction so when the customer is in need of a hard part down the road, O'Reilly is top of mind.",,,,,,sentence-level event detection,2021-05-26_10:11:22,,earnings call transcript,various,Q3_2012_O`Reilly_Automotive_Earnings_Conference_Call
eb06640f608eb9bf90843728e9ee293c67bdaa68,eb06640f608eb9bf90843728e9ee293c67bdaa68,3aeaee5ee67a0e8aa824405567bee5c229b4f343,3aeaee5ee67a0e8aa824405567bee5c229b4f343,3aeaee5ee67a0e8aa824405567bee5c229b4f343_118,Q3_2012_O`Reilly_Automotive_Earnings_Conference_Call_118,118,presentation,"We also continue to build our brand awareness to new and existing customers through our NASCAR and our NHRA race sponsorships, as well as grassroot marketing through local and regional races in the various community events.",,,,,,sentence-level event detection,2021-05-26_10:11:22,,earnings call transcript,various,Q3_2012_O`Reilly_Automotive_Earnings_Conference_Call
eb06640f608eb9bf90843728e9ee293c67bdaa68,eb06640f608eb9bf90843728e9ee293c67bdaa68,3aeaee5ee67a0e8aa824405567bee5c229b4f343,3aeaee5ee67a0e8aa824405567bee5c229b4f343,3aeaee5ee67a0e8aa824405567bee5c229b4f343_119,Q3_2012_O`Reilly_Automotive_Earnings_Conference_Call_119,119,presentation,"During the fourth quarter and into the new year, we will again be a big sponsor of college basketball, with on and off-court signage.",,,,,,sentence-level event detection,2021-05-26_10:11:22,,earnings call transcript,various,Q3_2012_O`Reilly_Automotive_Earnings_Conference_Call
eb06640f608eb9bf90843728e9ee293c67bdaa68,eb06640f608eb9bf90843728e9ee293c67bdaa68,3aeaee5ee67a0e8aa824405567bee5c229b4f343,3aeaee5ee67a0e8aa824405567bee5c229b4f343,3aeaee5ee67a0e8aa824405567bee5c229b4f343_120,Q3_2012_O`Reilly_Automotive_Earnings_Conference_Call_120,120,presentation,"Now, I would like to discuss our distribution operations.",,,,,,sentence-level event detection,2021-05-26_10:11:22,,earnings call transcript,various,Q3_2012_O`Reilly_Automotive_Earnings_Conference_Call
eb06640f608eb9bf90843728e9ee293c67bdaa68,eb06640f608eb9bf90843728e9ee293c67bdaa68,3aeaee5ee67a0e8aa824405567bee5c229b4f343,3aeaee5ee67a0e8aa824405567bee5c229b4f343,3aeaee5ee67a0e8aa824405567bee5c229b4f343_121,Q3_2012_O`Reilly_Automotive_Earnings_Conference_Call_121,121,presentation,The DCs continue to see improved efficiencies and have managed expenses very well in this difficult macro sales environment.,,,,,,sentence-level event detection,2021-05-26_10:11:22,,earnings call transcript,various,Q3_2012_O`Reilly_Automotive_Earnings_Conference_Call
eb06640f608eb9bf90843728e9ee293c67bdaa68,eb06640f608eb9bf90843728e9ee293c67bdaa68,3aeaee5ee67a0e8aa824405567bee5c229b4f343,3aeaee5ee67a0e8aa824405567bee5c229b4f343,3aeaee5ee67a0e8aa824405567bee5c229b4f343_122,Q3_2012_O`Reilly_Automotive_Earnings_Conference_Call_122,122,presentation,"Our established DCs have managed the slower-than-expected sales volumes very well by adjusting staffing needs, as needed, and our newer DCs continue to see efficiency improvements.",,,,,,sentence-level event detection,2021-05-26_10:11:22,,earnings call transcript,various,Q3_2012_O`Reilly_Automotive_Earnings_Conference_Call
eb06640f608eb9bf90843728e9ee293c67bdaa68,eb06640f608eb9bf90843728e9ee293c67bdaa68,3aeaee5ee67a0e8aa824405567bee5c229b4f343,3aeaee5ee67a0e8aa824405567bee5c229b4f343,3aeaee5ee67a0e8aa824405567bee5c229b4f343_123,Q3_2012_O`Reilly_Automotive_Earnings_Conference_Call_123,123,presentation,"The store-level inventory enhancement project Greg spoke about earlier put a heavy burden on our DCs, as significant stock-up volumes moved into and through our distribution network this year.",,,,,,sentence-level event detection,2021-05-26_10:11:22,,earnings call transcript,various,Q3_2012_O`Reilly_Automotive_Earnings_Conference_Call
eb06640f608eb9bf90843728e9ee293c67bdaa68,eb06640f608eb9bf90843728e9ee293c67bdaa68,3aeaee5ee67a0e8aa824405567bee5c229b4f343,3aeaee5ee67a0e8aa824405567bee5c229b4f343,3aeaee5ee67a0e8aa824405567bee5c229b4f343_124,Q3_2012_O`Reilly_Automotive_Earnings_Conference_Call_124,124,presentation,"However, even with this additional volume, our DC operations management team has effectively managed this project while continuing to provide industry-leading service to our stores.",,,,,,sentence-level event detection,2021-05-26_10:11:22,,earnings call transcript,various,Q3_2012_O`Reilly_Automotive_Earnings_Conference_Call
eb06640f608eb9bf90843728e9ee293c67bdaa68,eb06640f608eb9bf90843728e9ee293c67bdaa68,3aeaee5ee67a0e8aa824405567bee5c229b4f343,3aeaee5ee67a0e8aa824405567bee5c229b4f343,3aeaee5ee67a0e8aa824405567bee5c229b4f343_125,Q3_2012_O`Reilly_Automotive_Earnings_Conference_Call_125,125,presentation,Now I'd like to take this opportunity to talk about our future distribution network expansion.,,,,,,sentence-level event detection,2021-05-26_10:11:22,,earnings call transcript,various,Q3_2012_O`Reilly_Automotive_Earnings_Conference_Call
eb06640f608eb9bf90843728e9ee293c67bdaa68,eb06640f608eb9bf90843728e9ee293c67bdaa68,3aeaee5ee67a0e8aa824405567bee5c229b4f343,3aeaee5ee67a0e8aa824405567bee5c229b4f343,3aeaee5ee67a0e8aa824405567bee5c229b4f343_126,Q3_2012_O`Reilly_Automotive_Earnings_Conference_Call_126,126,presentation,"We are very pleased to announce plans to open a new DC in Lakeland, Florida.",,,,,,sentence-level event detection,2021-05-26_10:11:22,,earnings call transcript,various,Q3_2012_O`Reilly_Automotive_Earnings_Conference_Call
eb06640f608eb9bf90843728e9ee293c67bdaa68,eb06640f608eb9bf90843728e9ee293c67bdaa68,3aeaee5ee67a0e8aa824405567bee5c229b4f343,3aeaee5ee67a0e8aa824405567bee5c229b4f343,3aeaee5ee67a0e8aa824405567bee5c229b4f343_127,Q3_2012_O`Reilly_Automotive_Earnings_Conference_Call_127,127,presentation,"The 390,000-square foot DC is scheduled to open in the first quarter of 2014 and will service our existing stores in Northern Florida and support our expansion into Central and Southern Florida.",,,,,,sentence-level event detection,2021-05-26_10:11:22,,earnings call transcript,various,Q3_2012_O`Reilly_Automotive_Earnings_Conference_Call
eb06640f608eb9bf90843728e9ee293c67bdaa68,eb06640f608eb9bf90843728e9ee293c67bdaa68,3aeaee5ee67a0e8aa824405567bee5c229b4f343,3aeaee5ee67a0e8aa824405567bee5c229b4f343,3aeaee5ee67a0e8aa824405567bee5c229b4f343_128,Q3_2012_O`Reilly_Automotive_Earnings_Conference_Call_128,128,presentation,"Florida is largely untapped market for us, but offers tremendous potential for both the DIY and the professional sides of our Business.",,,,,,sentence-level event detection,2021-05-26_10:11:22,,earnings call transcript,various,Q3_2012_O`Reilly_Automotive_Earnings_Conference_Call
eb06640f608eb9bf90843728e9ee293c67bdaa68,eb06640f608eb9bf90843728e9ee293c67bdaa68,3aeaee5ee67a0e8aa824405567bee5c229b4f343,3aeaee5ee67a0e8aa824405567bee5c229b4f343,3aeaee5ee67a0e8aa824405567bee5c229b4f343_129,Q3_2012_O`Reilly_Automotive_Earnings_Conference_Call_129,129,presentation,"Currently, the real estate market in Florida is very attractive and the state offers great opportunities in both large and small markets.",,,,,,sentence-level event detection,2021-05-26_10:11:22,,earnings call transcript,various,Q3_2012_O`Reilly_Automotive_Earnings_Conference_Call
eb06640f608eb9bf90843728e9ee293c67bdaa68,eb06640f608eb9bf90843728e9ee293c67bdaa68,3aeaee5ee67a0e8aa824405567bee5c229b4f343,3aeaee5ee67a0e8aa824405567bee5c229b4f343,3aeaee5ee67a0e8aa824405567bee5c229b4f343_130,Q3_2012_O`Reilly_Automotive_Earnings_Conference_Call_130,130,presentation,"We currently have over 50 stores in the state, primarily in Northern Florida.",,,,,,sentence-level event detection,2021-05-26_10:11:22,,earnings call transcript,various,Q3_2012_O`Reilly_Automotive_Earnings_Conference_Call
eb06640f608eb9bf90843728e9ee293c67bdaa68,eb06640f608eb9bf90843728e9ee293c67bdaa68,3aeaee5ee67a0e8aa824405567bee5c229b4f343,3aeaee5ee67a0e8aa824405567bee5c229b4f343,3aeaee5ee67a0e8aa824405567bee5c229b4f343_131,Q3_2012_O`Reilly_Automotive_Earnings_Conference_Call_131,131,presentation,"Our 2012 and 2013 expansion plan is to continue to expand farther south, servicing the new stores out of our existing Atlanta and Mobile distribution centers.",,,,,,sentence-level event detection,2021-05-26_10:11:22,,earnings call transcript,various,Q3_2012_O`Reilly_Automotive_Earnings_Conference_Call
eb06640f608eb9bf90843728e9ee293c67bdaa68,eb06640f608eb9bf90843728e9ee293c67bdaa68,3aeaee5ee67a0e8aa824405567bee5c229b4f343,3aeaee5ee67a0e8aa824405567bee5c229b4f343,3aeaee5ee67a0e8aa824405567bee5c229b4f343_132,Q3_2012_O`Reilly_Automotive_Earnings_Conference_Call_132,132,presentation,"Central Florida will also be supported by our superhub stores, which were open during the first part of this year.",,,,,,sentence-level event detection,2021-05-26_10:11:22,,earnings call transcript,various,Q3_2012_O`Reilly_Automotive_Earnings_Conference_Call
eb06640f608eb9bf90843728e9ee293c67bdaa68,eb06640f608eb9bf90843728e9ee293c67bdaa68,3aeaee5ee67a0e8aa824405567bee5c229b4f343,3aeaee5ee67a0e8aa824405567bee5c229b4f343,3aeaee5ee67a0e8aa824405567bee5c229b4f343_133,Q3_2012_O`Reilly_Automotive_Earnings_Conference_Call_133,133,presentation,"Through these expansion efforts, we will open the new Lakeland distribution center with the proper store count to leverage the new DC from Day One.",,,,,,sentence-level event detection,2021-05-26_10:11:22,,earnings call transcript,various,Q3_2012_O`Reilly_Automotive_Earnings_Conference_Call
eb06640f608eb9bf90843728e9ee293c67bdaa68,eb06640f608eb9bf90843728e9ee293c67bdaa68,3aeaee5ee67a0e8aa824405567bee5c229b4f343,3aeaee5ee67a0e8aa824405567bee5c229b4f343,3aeaee5ee67a0e8aa824405567bee5c229b4f343_134,Q3_2012_O`Reilly_Automotive_Earnings_Conference_Call_134,134,presentation,"Finally, I would like to briefly speak to our expansion efforts during the first nine months of this year.",,,,,,sentence-level event detection,2021-05-26_10:11:22,,earnings call transcript,various,Q3_2012_O`Reilly_Automotive_Earnings_Conference_Call
eb06640f608eb9bf90843728e9ee293c67bdaa68,eb06640f608eb9bf90843728e9ee293c67bdaa68,3aeaee5ee67a0e8aa824405567bee5c229b4f343,3aeaee5ee67a0e8aa824405567bee5c229b4f343,3aeaee5ee67a0e8aa824405567bee5c229b4f343_135,Q3_2012_O`Reilly_Automotive_Earnings_Conference_Call_135,135,presentation,"During the quarter, we opened 37 net new stores, covering 20 states.",,,,,,sentence-level event detection,2021-05-26_10:11:22,,earnings call transcript,various,Q3_2012_O`Reilly_Automotive_Earnings_Conference_Call
eb06640f608eb9bf90843728e9ee293c67bdaa68,eb06640f608eb9bf90843728e9ee293c67bdaa68,3aeaee5ee67a0e8aa824405567bee5c229b4f343,3aeaee5ee67a0e8aa824405567bee5c229b4f343,3aeaee5ee67a0e8aa824405567bee5c229b4f343_136,Q3_2012_O`Reilly_Automotive_Earnings_Conference_Call_136,136,presentation,Eight of these new stores came from our acquired Western market stores.,,,,,,sentence-level event detection,2021-05-26_10:11:22,,earnings call transcript,various,Q3_2012_O`Reilly_Automotive_Earnings_Conference_Call
eb06640f608eb9bf90843728e9ee293c67bdaa68,eb06640f608eb9bf90843728e9ee293c67bdaa68,3aeaee5ee67a0e8aa824405567bee5c229b4f343,3aeaee5ee67a0e8aa824405567bee5c229b4f343,3aeaee5ee67a0e8aa824405567bee5c229b4f343_137,Q3_2012_O`Reilly_Automotive_Earnings_Conference_Call_137,137,presentation,"We continue to see good expansion opportunities in the Western markets, as we more thoroughly understand the individual markets and build to the O'Reilly brand awareness.",,,,,,sentence-level event detection,2021-05-26_10:11:22,,earnings call transcript,various,Q3_2012_O`Reilly_Automotive_Earnings_Conference_Call
eb06640f608eb9bf90843728e9ee293c67bdaa68,eb06640f608eb9bf90843728e9ee293c67bdaa68,3aeaee5ee67a0e8aa824405567bee5c229b4f343,3aeaee5ee67a0e8aa824405567bee5c229b4f343,3aeaee5ee67a0e8aa824405567bee5c229b4f343_138,Q3_2012_O`Reilly_Automotive_Earnings_Conference_Call_138,138,presentation,"For the year, we have opened 156 net new stores and we are highly confident we will hit our goal of 180 net new stores for 2012.",,,,,,sentence-level event detection,2021-05-26_10:11:22,,earnings call transcript,various,Q3_2012_O`Reilly_Automotive_Earnings_Conference_Call
