BATCH_ID,BATCH_UUID,DOCUMENT_UUID,FILE_UUID,TEXT_UUID,TEXT_ID,ROW_ID,SECTION,TEXT,LABEL,LABEL2,LABEL3,COMMENTS,ANNOTATOR_ID,TASK,TIMESTAMP_DELIVERED_TO_VENDOR,TIMESTAMP_VENDOR_DELIVERY,DOCUMENT_TYPE,SECTOR,SOURCE_DOCUMENT_URI
eb06640f608eb9bf90843728e9ee293c67bdaa68,eb06640f608eb9bf90843728e9ee293c67bdaa68,3aeaee5ee67a0e8aa824405567bee5c229b4f343,3aeaee5ee67a0e8aa824405567bee5c229b4f343,3aeaee5ee67a0e8aa824405567bee5c229b4f343_335,Q3_2012_O`Reilly_Automotive_Earnings_Conference_Call_335,335,answer,"When we look year to date, we're relatively flat, maybe a little bit of price pressure, which creates a little bit of headwind versus last year through this time of the year when we had seen a tailwind from inflation.",,,,,,sentence-level event detection,2021-05-26_10:11:22,,earnings call transcript,various,Q3_2012_O`Reilly_Automotive_Earnings_Conference_Call
eb06640f608eb9bf90843728e9ee293c67bdaa68,eb06640f608eb9bf90843728e9ee293c67bdaa68,3aeaee5ee67a0e8aa824405567bee5c229b4f343,3aeaee5ee67a0e8aa824405567bee5c229b4f343,3aeaee5ee67a0e8aa824405567bee5c229b4f343_337,Q3_2012_O`Reilly_Automotive_Earnings_Conference_Call_337,337,answer,"And then just, Greg, from a broader perspective, just the drivers of comps, the effect of weather, stuff like that -- we feel like that the cold winter, as exemplified by our performance in these Northern markets and our competitors' performance in these Northern markets, that there's no question they had an effect.",,,,,,sentence-level event detection,2021-05-26_10:11:22,,earnings call transcript,various,Q3_2012_O`Reilly_Automotive_Earnings_Conference_Call
eb06640f608eb9bf90843728e9ee293c67bdaa68,eb06640f608eb9bf90843728e9ee293c67bdaa68,3aeaee5ee67a0e8aa824405567bee5c229b4f343,3aeaee5ee67a0e8aa824405567bee5c229b4f343,3aeaee5ee67a0e8aa824405567bee5c229b4f343_338,Q3_2012_O`Reilly_Automotive_Earnings_Conference_Call_338,338,answer,"The extent to which it's a factor is a little bit hard to measure, other than the way that we articulate the performance.",,,,,,sentence-level event detection,2021-05-26_10:11:22,,earnings call transcript,various,Q3_2012_O`Reilly_Automotive_Earnings_Conference_Call
eb06640f608eb9bf90843728e9ee293c67bdaa68,eb06640f608eb9bf90843728e9ee293c67bdaa68,3aeaee5ee67a0e8aa824405567bee5c229b4f343,3aeaee5ee67a0e8aa824405567bee5c229b4f343,3aeaee5ee67a0e8aa824405567bee5c229b4f343_339,Q3_2012_O`Reilly_Automotive_Earnings_Conference_Call_339,339,answer,"We gave a little more information this time than we would normally give, and similar to our competitors, we're trying to give everyone the ability to assess that situation as best they can.",,,,,,sentence-level event detection,2021-05-26_10:11:22,,earnings call transcript,various,Q3_2012_O`Reilly_Automotive_Earnings_Conference_Call
eb06640f608eb9bf90843728e9ee293c67bdaa68,eb06640f608eb9bf90843728e9ee293c67bdaa68,3aeaee5ee67a0e8aa824405567bee5c229b4f343,3aeaee5ee67a0e8aa824405567bee5c229b4f343,3aeaee5ee67a0e8aa824405567bee5c229b4f343_340,Q3_2012_O`Reilly_Automotive_Earnings_Conference_Call_340,340,answer,We've been very encouraged by our performance so far this quarter.,,,,,,sentence-level event detection,2021-05-26_10:11:22,,earnings call transcript,various,Q3_2012_O`Reilly_Automotive_Earnings_Conference_Call
eb06640f608eb9bf90843728e9ee293c67bdaa68,eb06640f608eb9bf90843728e9ee293c67bdaa68,3aeaee5ee67a0e8aa824405567bee5c229b4f343,3aeaee5ee67a0e8aa824405567bee5c229b4f343,3aeaee5ee67a0e8aa824405567bee5c229b4f343_341,Q3_2012_O`Reilly_Automotive_Earnings_Conference_Call_341,341,answer,"Our comp-store sales started improving at the end of September and that improvement has very consistently sustained to this point, three-and-a-half weeks through the fourth quarter.",,,,,,sentence-level event detection,2021-05-26_10:11:22,,earnings call transcript,various,Q3_2012_O`Reilly_Automotive_Earnings_Conference_Call
eb06640f608eb9bf90843728e9ee293c67bdaa68,eb06640f608eb9bf90843728e9ee293c67bdaa68,3aeaee5ee67a0e8aa824405567bee5c229b4f343,3aeaee5ee67a0e8aa824405567bee5c229b4f343,3aeaee5ee67a0e8aa824405567bee5c229b4f343_342,Q3_2012_O`Reilly_Automotive_Earnings_Conference_Call_342,342,answer,"Like we talked about, the holiday season can be a little volatile because of holiday spending and things like that, but our expectation or estimate, just based on years in this business, would be that if we have a cold winter this winter, that very likely the aftermarket will have a good season.",,,,,,sentence-level event detection,2021-05-26_10:11:22,,earnings call transcript,various,Q3_2012_O`Reilly_Automotive_Earnings_Conference_Call
eb06640f608eb9bf90843728e9ee293c67bdaa68,eb06640f608eb9bf90843728e9ee293c67bdaa68,3aeaee5ee67a0e8aa824405567bee5c229b4f343,3aeaee5ee67a0e8aa824405567bee5c229b4f343,3aeaee5ee67a0e8aa824405567bee5c229b4f343_343,Q3_2012_O`Reilly_Automotive_Earnings_Conference_Call_343,343,question,That's great.,,,,,,sentence-level event detection,2021-05-26_10:11:22,,earnings call transcript,various,Q3_2012_O`Reilly_Automotive_Earnings_Conference_Call
eb06640f608eb9bf90843728e9ee293c67bdaa68,eb06640f608eb9bf90843728e9ee293c67bdaa68,3aeaee5ee67a0e8aa824405567bee5c229b4f343,3aeaee5ee67a0e8aa824405567bee5c229b4f343,3aeaee5ee67a0e8aa824405567bee5c229b4f343_344,Q3_2012_O`Reilly_Automotive_Earnings_Conference_Call_344,344,question,"And Tom, if I could just follow up on your answer.",,,,,,sentence-level event detection,2021-05-26_10:11:22,,earnings call transcript,various,Q3_2012_O`Reilly_Automotive_Earnings_Conference_Call
eb06640f608eb9bf90843728e9ee293c67bdaa68,eb06640f608eb9bf90843728e9ee293c67bdaa68,3aeaee5ee67a0e8aa824405567bee5c229b4f343,3aeaee5ee67a0e8aa824405567bee5c229b4f343,3aeaee5ee67a0e8aa824405567bee5c229b4f343_345,Q3_2012_O`Reilly_Automotive_Earnings_Conference_Call_345,345,question,Last year there was some inflation -- could you help us quantify that?,,,,,,sentence-level event detection,2021-05-26_10:11:22,,earnings call transcript,various,Q3_2012_O`Reilly_Automotive_Earnings_Conference_Call
eb06640f608eb9bf90843728e9ee293c67bdaa68,eb06640f608eb9bf90843728e9ee293c67bdaa68,3aeaee5ee67a0e8aa824405567bee5c229b4f343,3aeaee5ee67a0e8aa824405567bee5c229b4f343,3aeaee5ee67a0e8aa824405567bee5c229b4f343_346,Q3_2012_O`Reilly_Automotive_Earnings_Conference_Call_346,346,question,Was it like 100 bps or 200 bps or --?,,,,,,sentence-level event detection,2021-05-26_10:11:22,,earnings call transcript,various,Q3_2012_O`Reilly_Automotive_Earnings_Conference_Call
eb06640f608eb9bf90843728e9ee293c67bdaa68,eb06640f608eb9bf90843728e9ee293c67bdaa68,3aeaee5ee67a0e8aa824405567bee5c229b4f343,3aeaee5ee67a0e8aa824405567bee5c229b4f343,3aeaee5ee67a0e8aa824405567bee5c229b4f343_347,Q3_2012_O`Reilly_Automotive_Earnings_Conference_Call_347,347,answer,It would be between those two.,,,,,,sentence-level event detection,2021-05-26_10:11:22,,earnings call transcript,various,Q3_2012_O`Reilly_Automotive_Earnings_Conference_Call
eb06640f608eb9bf90843728e9ee293c67bdaa68,eb06640f608eb9bf90843728e9ee293c67bdaa68,3aeaee5ee67a0e8aa824405567bee5c229b4f343,3aeaee5ee67a0e8aa824405567bee5c229b4f343,3aeaee5ee67a0e8aa824405567bee5c229b4f343_349,Q3_2012_O`Reilly_Automotive_Earnings_Conference_Call_349,349,question,Thanks a lot.,,,,,,sentence-level event detection,2021-05-26_10:11:22,,earnings call transcript,various,Q3_2012_O`Reilly_Automotive_Earnings_Conference_Call
eb06640f608eb9bf90843728e9ee293c67bdaa68,eb06640f608eb9bf90843728e9ee293c67bdaa68,3aeaee5ee67a0e8aa824405567bee5c229b4f343,3aeaee5ee67a0e8aa824405567bee5c229b4f343,3aeaee5ee67a0e8aa824405567bee5c229b4f343_351,Q3_2012_O`Reilly_Automotive_Earnings_Conference_Call_351,351,question,And your next question comes from the line of [Dave Gober] of Morgan Stanley.,,,,,,sentence-level event detection,2021-05-26_10:11:22,,earnings call transcript,various,Q3_2012_O`Reilly_Automotive_Earnings_Conference_Call
eb06640f608eb9bf90843728e9ee293c67bdaa68,eb06640f608eb9bf90843728e9ee293c67bdaa68,3aeaee5ee67a0e8aa824405567bee5c229b4f343,3aeaee5ee67a0e8aa824405567bee5c229b4f343,3aeaee5ee67a0e8aa824405567bee5c229b4f343_352,Q3_2012_O`Reilly_Automotive_Earnings_Conference_Call_352,352,question,Going back on the top line -- and not to get into too much of any degree there -- but are you seeing that drag from the weather-impacted markets fading at all?,,,,,,sentence-level event detection,2021-05-26_10:11:22,,earnings call transcript,various,Q3_2012_O`Reilly_Automotive_Earnings_Conference_Call
eb06640f608eb9bf90843728e9ee293c67bdaa68,eb06640f608eb9bf90843728e9ee293c67bdaa68,3aeaee5ee67a0e8aa824405567bee5c229b4f343,3aeaee5ee67a0e8aa824405567bee5c229b4f343,3aeaee5ee67a0e8aa824405567bee5c229b4f343_353,Q3_2012_O`Reilly_Automotive_Earnings_Conference_Call_353,353,question,"Is that what you're seeing in late September, early October?",,,,,,sentence-level event detection,2021-05-26_10:11:22,,earnings call transcript,various,Q3_2012_O`Reilly_Automotive_Earnings_Conference_Call
eb06640f608eb9bf90843728e9ee293c67bdaa68,eb06640f608eb9bf90843728e9ee293c67bdaa68,3aeaee5ee67a0e8aa824405567bee5c229b4f343,3aeaee5ee67a0e8aa824405567bee5c229b4f343,3aeaee5ee67a0e8aa824405567bee5c229b4f343_354,Q3_2012_O`Reilly_Automotive_Earnings_Conference_Call_354,354,question,"And as we think about the fourth quarter, you mentioned that the 50-basis point headwind from the shift in Christmas, but are you also picking back up the Sunday that you lost in the third quarter?",,,,,,sentence-level event detection,2021-05-26_10:11:22,,earnings call transcript,various,Q3_2012_O`Reilly_Automotive_Earnings_Conference_Call
eb06640f608eb9bf90843728e9ee293c67bdaa68,eb06640f608eb9bf90843728e9ee293c67bdaa68,3aeaee5ee67a0e8aa824405567bee5c229b4f343,3aeaee5ee67a0e8aa824405567bee5c229b4f343,3aeaee5ee67a0e8aa824405567bee5c229b4f343_356,Q3_2012_O`Reilly_Automotive_Earnings_Conference_Call_356,356,answer,I'll address the Sundays.,,,,,,sentence-level event detection,2021-05-26_10:11:22,,earnings call transcript,various,Q3_2012_O`Reilly_Automotive_Earnings_Conference_Call
eb06640f608eb9bf90843728e9ee293c67bdaa68,eb06640f608eb9bf90843728e9ee293c67bdaa68,3aeaee5ee67a0e8aa824405567bee5c229b4f343,3aeaee5ee67a0e8aa824405567bee5c229b4f343,3aeaee5ee67a0e8aa824405567bee5c229b4f343_357,Q3_2012_O`Reilly_Automotive_Earnings_Conference_Call_357,357,answer,"We have an extra Sunday during the year, so we have the same number of Sundays in the fourth quarter as last year, except that we were closed one of those Sundays last year and not closed this year.",,,,,,sentence-level event detection,2021-05-26_10:11:22,,earnings call transcript,various,Q3_2012_O`Reilly_Automotive_Earnings_Conference_Call
eb06640f608eb9bf90843728e9ee293c67bdaa68,eb06640f608eb9bf90843728e9ee293c67bdaa68,3aeaee5ee67a0e8aa824405567bee5c229b4f343,3aeaee5ee67a0e8aa824405567bee5c229b4f343,3aeaee5ee67a0e8aa824405567bee5c229b4f343_358,Q3_2012_O`Reilly_Automotive_Earnings_Conference_Call_358,358,answer,"So in essence, same number of Sundays, but we pick up an extra Sunday business day.",,,,,,sentence-level event detection,2021-05-26_10:11:22,,earnings call transcript,various,Q3_2012_O`Reilly_Automotive_Earnings_Conference_Call
eb06640f608eb9bf90843728e9ee293c67bdaa68,eb06640f608eb9bf90843728e9ee293c67bdaa68,3aeaee5ee67a0e8aa824405567bee5c229b4f343,3aeaee5ee67a0e8aa824405567bee5c229b4f343,3aeaee5ee67a0e8aa824405567bee5c229b4f343_359,Q3_2012_O`Reilly_Automotive_Earnings_Conference_Call_359,359,answer,"And then to answer your question as far as the weather drag, or the potential effect on the markets that were most affected by weather -- yes, we've seen a nice improvement during this past four or five-week period in the markets that have been most affected by weather.",,,,,,sentence-level event detection,2021-05-26_10:11:22,,earnings call transcript,various,Q3_2012_O`Reilly_Automotive_Earnings_Conference_Call
eb06640f608eb9bf90843728e9ee293c67bdaa68,eb06640f608eb9bf90843728e9ee293c67bdaa68,3aeaee5ee67a0e8aa824405567bee5c229b4f343,3aeaee5ee67a0e8aa824405567bee5c229b4f343,3aeaee5ee67a0e8aa824405567bee5c229b4f343_360,Q3_2012_O`Reilly_Automotive_Earnings_Conference_Call_360,360,answer,"Those markets, winter comes earlier and people start thinking about maintaining their car for winter earlier.",,,,,,sentence-level event detection,2021-05-26_10:11:22,,earnings call transcript,various,Q3_2012_O`Reilly_Automotive_Earnings_Conference_Call
eb06640f608eb9bf90843728e9ee293c67bdaa68,eb06640f608eb9bf90843728e9ee293c67bdaa68,3aeaee5ee67a0e8aa824405567bee5c229b4f343,3aeaee5ee67a0e8aa824405567bee5c229b4f343,3aeaee5ee67a0e8aa824405567bee5c229b4f343_361,Q3_2012_O`Reilly_Automotive_Earnings_Conference_Call_361,361,answer,Batteries that were fried -- for lack of a better word -- during the summer fail as weather starts getting colder and the engines start getting harder to crank.,,,,,,sentence-level event detection,2021-05-26_10:11:22,,earnings call transcript,various,Q3_2012_O`Reilly_Automotive_Earnings_Conference_Call
eb06640f608eb9bf90843728e9ee293c67bdaa68,eb06640f608eb9bf90843728e9ee293c67bdaa68,3aeaee5ee67a0e8aa824405567bee5c229b4f343,3aeaee5ee67a0e8aa824405567bee5c229b4f343,3aeaee5ee67a0e8aa824405567bee5c229b4f343_362,Q3_2012_O`Reilly_Automotive_Earnings_Conference_Call_362,362,answer,We've seen good performance in that category as a result of weather.,,,,,,sentence-level event detection,2021-05-26_10:11:22,,earnings call transcript,various,Q3_2012_O`Reilly_Automotive_Earnings_Conference_Call
eb06640f608eb9bf90843728e9ee293c67bdaa68,eb06640f608eb9bf90843728e9ee293c67bdaa68,3aeaee5ee67a0e8aa824405567bee5c229b4f343,3aeaee5ee67a0e8aa824405567bee5c229b4f343,3aeaee5ee67a0e8aa824405567bee5c229b4f343_363,Q3_2012_O`Reilly_Automotive_Earnings_Conference_Call_363,363,answer,"Yes, we've seen a sequential pickup in those markets that has been a little better than what we would have had in the markets that are in more moderate regions of the country.",,,,,,sentence-level event detection,2021-05-26_10:11:22,,earnings call transcript,various,Q3_2012_O`Reilly_Automotive_Earnings_Conference_Call
eb06640f608eb9bf90843728e9ee293c67bdaa68,eb06640f608eb9bf90843728e9ee293c67bdaa68,3aeaee5ee67a0e8aa824405567bee5c229b4f343,3aeaee5ee67a0e8aa824405567bee5c229b4f343,3aeaee5ee67a0e8aa824405567bee5c229b4f343_364,Q3_2012_O`Reilly_Automotive_Earnings_Conference_Call_364,364,question,"Okay, good to hear.",,,,,,sentence-level event detection,2021-05-26_10:11:22,,earnings call transcript,various,Q3_2012_O`Reilly_Automotive_Earnings_Conference_Call
eb06640f608eb9bf90843728e9ee293c67bdaa68,eb06640f608eb9bf90843728e9ee293c67bdaa68,3aeaee5ee67a0e8aa824405567bee5c229b4f343,3aeaee5ee67a0e8aa824405567bee5c229b4f343,3aeaee5ee67a0e8aa824405567bee5c229b4f343_365,Q3_2012_O`Reilly_Automotive_Earnings_Conference_Call_365,365,question,"And I guess a follow up -- just thinking about the longer-term secular environment, which I think you touched on in your prepared remarks, particularly with the aging of the car part.",,,,,,sentence-level event detection,2021-05-26_10:11:22,,earnings call transcript,various,Q3_2012_O`Reilly_Automotive_Earnings_Conference_Call
eb06640f608eb9bf90843728e9ee293c67bdaa68,eb06640f608eb9bf90843728e9ee293c67bdaa68,3aeaee5ee67a0e8aa824405567bee5c229b4f343,3aeaee5ee67a0e8aa824405567bee5c229b4f343,3aeaee5ee67a0e8aa824405567bee5c229b4f343_366,Q3_2012_O`Reilly_Automotive_Earnings_Conference_Call_366,366,question,Could you talk about the sweet spot of the car part?,,,,,,sentence-level event detection,2021-05-26_10:11:22,,earnings call transcript,various,Q3_2012_O`Reilly_Automotive_Earnings_Conference_Call
eb06640f608eb9bf90843728e9ee293c67bdaa68,eb06640f608eb9bf90843728e9ee293c67bdaa68,3aeaee5ee67a0e8aa824405567bee5c229b4f343,3aeaee5ee67a0e8aa824405567bee5c229b4f343,3aeaee5ee67a0e8aa824405567bee5c229b4f343_367,Q3_2012_O`Reilly_Automotive_Earnings_Conference_Call_367,367,question,How do you think that has evolved?,,,,,,sentence-level event detection,2021-05-26_10:11:22,,earnings call transcript,various,Q3_2012_O`Reilly_Automotive_Earnings_Conference_Call
eb06640f608eb9bf90843728e9ee293c67bdaa68,eb06640f608eb9bf90843728e9ee293c67bdaa68,3aeaee5ee67a0e8aa824405567bee5c229b4f343,3aeaee5ee67a0e8aa824405567bee5c229b4f343,3aeaee5ee67a0e8aa824405567bee5c229b4f343_368,Q3_2012_O`Reilly_Automotive_Earnings_Conference_Call_368,368,question,Historically you would have thought -- cars aged seven to twelve or somewhere thereabouts would be the sweet spot.,,,,,,sentence-level event detection,2021-05-26_10:11:22,,earnings call transcript,various,Q3_2012_O`Reilly_Automotive_Earnings_Conference_Call
eb06640f608eb9bf90843728e9ee293c67bdaa68,eb06640f608eb9bf90843728e9ee293c67bdaa68,3aeaee5ee67a0e8aa824405567bee5c229b4f343,3aeaee5ee67a0e8aa824405567bee5c229b4f343,3aeaee5ee67a0e8aa824405567bee5c229b4f343_369,Q3_2012_O`Reilly_Automotive_Earnings_Conference_Call_369,369,question,Do you think that's extended?,,,,,,sentence-level event detection,2021-05-26_10:11:22,,earnings call transcript,various,Q3_2012_O`Reilly_Automotive_Earnings_Conference_Call
eb06640f608eb9bf90843728e9ee293c67bdaa68,eb06640f608eb9bf90843728e9ee293c67bdaa68,3aeaee5ee67a0e8aa824405567bee5c229b4f343,3aeaee5ee67a0e8aa824405567bee5c229b4f343,3aeaee5ee67a0e8aa824405567bee5c229b4f343_370,Q3_2012_O`Reilly_Automotive_Earnings_Conference_Call_370,370,question,And what do you think the spend per vehicle looks like outside of that?,,,,,,sentence-level event detection,2021-05-26_10:11:22,,earnings call transcript,various,Q3_2012_O`Reilly_Automotive_Earnings_Conference_Call
eb06640f608eb9bf90843728e9ee293c67bdaa68,eb06640f608eb9bf90843728e9ee293c67bdaa68,3aeaee5ee67a0e8aa824405567bee5c229b4f343,3aeaee5ee67a0e8aa824405567bee5c229b4f343,3aeaee5ee67a0e8aa824405567bee5c229b4f343_371,Q3_2012_O`Reilly_Automotive_Earnings_Conference_Call_371,371,question,"Because I think one of the concerns over the next few years is that we are going to have a lot of very old cars, and is the drop-off after year 13 or 14 or 15, is it a 10% drop off, is it 20% drop off once you get out of that sweet spot?",,,,,,sentence-level event detection,2021-05-26_10:11:22,,earnings call transcript,various,Q3_2012_O`Reilly_Automotive_Earnings_Conference_Call
eb06640f608eb9bf90843728e9ee293c67bdaa68,eb06640f608eb9bf90843728e9ee293c67bdaa68,3aeaee5ee67a0e8aa824405567bee5c229b4f343,3aeaee5ee67a0e8aa824405567bee5c229b4f343,3aeaee5ee67a0e8aa824405567bee5c229b4f343_372,Q3_2012_O`Reilly_Automotive_Earnings_Conference_Call_372,372,question,And how do you think that evolves over the next couple of years?,,,,,,sentence-level event detection,2021-05-26_10:11:22,,earnings call transcript,various,Q3_2012_O`Reilly_Automotive_Earnings_Conference_Call
eb06640f608eb9bf90843728e9ee293c67bdaa68,eb06640f608eb9bf90843728e9ee293c67bdaa68,3aeaee5ee67a0e8aa824405567bee5c229b4f343,3aeaee5ee67a0e8aa824405567bee5c229b4f343,3aeaee5ee67a0e8aa824405567bee5c229b4f343_374,Q3_2012_O`Reilly_Automotive_Earnings_Conference_Call_374,374,answer,"Well, what I would say to that is just a couple, three years ago, you would hear us say that the sweet spot was maybe six to 10 years; and as people have hung on to their cars longer.",,,,,,sentence-level event detection,2021-05-26_10:11:22,,earnings call transcript,various,Q3_2012_O`Reilly_Automotive_Earnings_Conference_Call
eb06640f608eb9bf90843728e9ee293c67bdaa68,eb06640f608eb9bf90843728e9ee293c67bdaa68,3aeaee5ee67a0e8aa824405567bee5c229b4f343,3aeaee5ee67a0e8aa824405567bee5c229b4f343,3aeaee5ee67a0e8aa824405567bee5c229b4f343_375,Q3_2012_O`Reilly_Automotive_Earnings_Conference_Call_375,375,answer,And I feel like the quality of the engineering and the manufacture of new cars has been recognized by consumers as they've driven these cars at higher mileages.,,,,,,sentence-level event detection,2021-05-26_10:11:22,,earnings call transcript,various,Q3_2012_O`Reilly_Automotive_Earnings_Conference_Call
eb06640f608eb9bf90843728e9ee293c67bdaa68,eb06640f608eb9bf90843728e9ee293c67bdaa68,3aeaee5ee67a0e8aa824405567bee5c229b4f343,3aeaee5ee67a0e8aa824405567bee5c229b4f343,3aeaee5ee67a0e8aa824405567bee5c229b4f343_376,Q3_2012_O`Reilly_Automotive_Earnings_Conference_Call_376,376,answer,"I think that's moved forward a little better, or extended a bit.",,,,,,sentence-level event detection,2021-05-26_10:11:22,,earnings call transcript,various,Q3_2012_O`Reilly_Automotive_Earnings_Conference_Call
eb06640f608eb9bf90843728e9ee293c67bdaa68,eb06640f608eb9bf90843728e9ee293c67bdaa68,3aeaee5ee67a0e8aa824405567bee5c229b4f343,3aeaee5ee67a0e8aa824405567bee5c229b4f343,3aeaee5ee67a0e8aa824405567bee5c229b4f343_377,Q3_2012_O`Reilly_Automotive_Earnings_Conference_Call_377,377,answer,It's maybe more six to 12 or something like that.,,,,,,sentence-level event detection,2021-05-26_10:11:22,,earnings call transcript,various,Q3_2012_O`Reilly_Automotive_Earnings_Conference_Call
eb06640f608eb9bf90843728e9ee293c67bdaa68,eb06640f608eb9bf90843728e9ee293c67bdaa68,3aeaee5ee67a0e8aa824405567bee5c229b4f343,3aeaee5ee67a0e8aa824405567bee5c229b4f343,3aeaee5ee67a0e8aa824405567bee5c229b4f343_378,Q3_2012_O`Reilly_Automotive_Earnings_Conference_Call_378,378,answer,"I guess I don't really have any scientific data to answer your question, so I don't really know when we would see a drop off relative to an age of a vehicle.",,,,,,sentence-level event detection,2021-05-26_10:11:22,,earnings call transcript,various,Q3_2012_O`Reilly_Automotive_Earnings_Conference_Call
eb06640f608eb9bf90843728e9ee293c67bdaa68,eb06640f608eb9bf90843728e9ee293c67bdaa68,3aeaee5ee67a0e8aa824405567bee5c229b4f343,3aeaee5ee67a0e8aa824405567bee5c229b4f343,3aeaee5ee67a0e8aa824405567bee5c229b4f343_379,Q3_2012_O`Reilly_Automotive_Earnings_Conference_Call_379,379,answer,"What I would say is that if you're driving a car, that you're a daily driver and it's your commuting vehicle, which in many of our markets -- in Dallas/Fort Worth or Houston -- you might have a 50 or a 80-mile daily commute back and forth -- not one way, but both ways, to get to work and back, you've got to have reliable transportation.",,,,,,sentence-level event detection,2021-05-26_10:11:22,,earnings call transcript,various,Q3_2012_O`Reilly_Automotive_Earnings_Conference_Call
eb06640f608eb9bf90843728e9ee293c67bdaa68,eb06640f608eb9bf90843728e9ee293c67bdaa68,3aeaee5ee67a0e8aa824405567bee5c229b4f343,3aeaee5ee67a0e8aa824405567bee5c229b4f343,3aeaee5ee67a0e8aa824405567bee5c229b4f343_380,Q3_2012_O`Reilly_Automotive_Earnings_Conference_Call_380,380,answer,"If a car is 12 years old or 13 years old or 14 years old, you still have to do the primary things to maintain that car to drive it every day.",,,,,,sentence-level event detection,2021-05-26_10:11:22,,earnings call transcript,various,Q3_2012_O`Reilly_Automotive_Earnings_Conference_Call
eb06640f608eb9bf90843728e9ee293c67bdaa68,eb06640f608eb9bf90843728e9ee293c67bdaa68,3aeaee5ee67a0e8aa824405567bee5c229b4f343,3aeaee5ee67a0e8aa824405567bee5c229b4f343,3aeaee5ee67a0e8aa824405567bee5c229b4f343_381,Q3_2012_O`Reilly_Automotive_Earnings_Conference_Call_381,381,answer,"Now, that doesn't mean that you're going to be fixing a rust spot that comes up or fixing the seat that might have worn through or fixing the cracked dash or something like that.",,,,,,sentence-level event detection,2021-05-26_10:11:22,,earnings call transcript,various,Q3_2012_O`Reilly_Automotive_Earnings_Conference_Call
eb06640f608eb9bf90843728e9ee293c67bdaa68,eb06640f608eb9bf90843728e9ee293c67bdaa68,3aeaee5ee67a0e8aa824405567bee5c229b4f343,3aeaee5ee67a0e8aa824405567bee5c229b4f343,3aeaee5ee67a0e8aa824405567bee5c229b4f343_382,Q3_2012_O`Reilly_Automotive_Earnings_Conference_Call_382,382,answer,There's going to be some things that cause the car to maybe not look as good as it did when it was new or five years old or six years old.,,,,,,sentence-level event detection,2021-05-26_10:11:22,,earnings call transcript,various,Q3_2012_O`Reilly_Automotive_Earnings_Conference_Call
eb06640f608eb9bf90843728e9ee293c67bdaa68,eb06640f608eb9bf90843728e9ee293c67bdaa68,3aeaee5ee67a0e8aa824405567bee5c229b4f343,3aeaee5ee67a0e8aa824405567bee5c229b4f343,3aeaee5ee67a0e8aa824405567bee5c229b4f343_383,Q3_2012_O`Reilly_Automotive_Earnings_Conference_Call_383,383,answer,"But still, the mechanical part of the car has to work well for it to be reliable transportation.",,,,,,sentence-level event detection,2021-05-26_10:11:22,,earnings call transcript,various,Q3_2012_O`Reilly_Automotive_Earnings_Conference_Call
eb06640f608eb9bf90843728e9ee293c67bdaa68,eb06640f608eb9bf90843728e9ee293c67bdaa68,3aeaee5ee67a0e8aa824405567bee5c229b4f343,3aeaee5ee67a0e8aa824405567bee5c229b4f343,3aeaee5ee67a0e8aa824405567bee5c229b4f343_384,Q3_2012_O`Reilly_Automotive_Earnings_Conference_Call_384,384,answer,"In many cases, these cars are not only the commuter cars, they're cars that families use for vacations and weekend outings and things like that, so they have to be safe and well maintained.",,,,,,sentence-level event detection,2021-05-26_10:11:22,,earnings call transcript,various,Q3_2012_O`Reilly_Automotive_Earnings_Conference_Call
eb06640f608eb9bf90843728e9ee293c67bdaa68,eb06640f608eb9bf90843728e9ee293c67bdaa68,3aeaee5ee67a0e8aa824405567bee5c229b4f343,3aeaee5ee67a0e8aa824405567bee5c229b4f343,3aeaee5ee67a0e8aa824405567bee5c229b4f343_385,Q3_2012_O`Reilly_Automotive_Earnings_Conference_Call_385,385,answer,So I think the answer to your question is yet to be seen.,,,,,,sentence-level event detection,2021-05-26_10:11:22,,earnings call transcript,various,Q3_2012_O`Reilly_Automotive_Earnings_Conference_Call
eb06640f608eb9bf90843728e9ee293c67bdaa68,eb06640f608eb9bf90843728e9ee293c67bdaa68,3aeaee5ee67a0e8aa824405567bee5c229b4f343,3aeaee5ee67a0e8aa824405567bee5c229b4f343,3aeaee5ee67a0e8aa824405567bee5c229b4f343_386,Q3_2012_O`Reilly_Automotive_Earnings_Conference_Call_386,386,answer,"But we view it as being unlikely and very difficult for a consumer to just say that because the car's 13 or 14 years old, they're going to stop maintaining it.",,,,,,sentence-level event detection,2021-05-26_10:11:22,,earnings call transcript,various,Q3_2012_O`Reilly_Automotive_Earnings_Conference_Call
