BATCH_ID,BATCH_UUID,DOCUMENT_UUID,FILE_UUID,TEXT_UUID,TEXT_ID,ROW_ID,SECTION,TEXT,LABEL,LABEL2,LABEL3,COMMENTS,ANNOTATOR_ID,TASK,TIMESTAMP_DELIVERED_TO_VENDOR,TIMESTAMP_VENDOR_DELIVERY,DOCUMENT_TYPE,SECTOR,SOURCE_DOCUMENT_URI
c61f89fc819d52ad7d47da45724ab4aef3e2809a,c61f89fc819d52ad7d47da45724ab4aef3e2809a,a47ecbfd85edf33d7bcd9e6752872cb9c7785504,a47ecbfd85edf33d7bcd9e6752872cb9c7785504,a47ecbfd85edf33d7bcd9e6752872cb9c7785504_741,Preliminary_2012_TELSTRA_CORPORATION_LIMITED_Earnings_Presentation_741,741,answer,"David, maybe to add as well, looking at Paul Geason here, because that's putting Paul under too much pressure, I think the other point to make is that as we sit here today, the proportion of our outlook and target for 2013 that is incumbent in existing contracts which have been signed, because of those big contracts being signed is, it's a bigger proportion than it was this time last year, which augers well for next year.",,,,,,sentence-level event detection,2021-06-10_10:53:19,,earnings call transcript,various,Preliminary_2012_TELSTRA_CORPORATION_LIMITED_Earnings_Presentation
c61f89fc819d52ad7d47da45724ab4aef3e2809a,c61f89fc819d52ad7d47da45724ab4aef3e2809a,a47ecbfd85edf33d7bcd9e6752872cb9c7785504,a47ecbfd85edf33d7bcd9e6752872cb9c7785504,a47ecbfd85edf33d7bcd9e6752872cb9c7785504_742,Preliminary_2012_TELSTRA_CORPORATION_LIMITED_Earnings_Presentation_742,742,question,"Bradley Clibborn, Credit Suisse.",,,,,,sentence-level event detection,2021-06-10_10:53:19,,earnings call transcript,various,Preliminary_2012_TELSTRA_CORPORATION_LIMITED_Earnings_Presentation
c61f89fc819d52ad7d47da45724ab4aef3e2809a,c61f89fc819d52ad7d47da45724ab4aef3e2809a,a47ecbfd85edf33d7bcd9e6752872cb9c7785504,a47ecbfd85edf33d7bcd9e6752872cb9c7785504,a47ecbfd85edf33d7bcd9e6752872cb9c7785504_743,Preliminary_2012_TELSTRA_CORPORATION_LIMITED_Earnings_Presentation_743,743,question,"Just two quick ones from me; firstly, in terms of the tax rate.",,,,,,sentence-level event detection,2021-06-10_10:53:19,,earnings call transcript,various,Preliminary_2012_TELSTRA_CORPORATION_LIMITED_Earnings_Presentation
c61f89fc819d52ad7d47da45724ab4aef3e2809a,c61f89fc819d52ad7d47da45724ab4aef3e2809a,a47ecbfd85edf33d7bcd9e6752872cb9c7785504,a47ecbfd85edf33d7bcd9e6752872cb9c7785504,a47ecbfd85edf33d7bcd9e6752872cb9c7785504_744,Preliminary_2012_TELSTRA_CORPORATION_LIMITED_Earnings_Presentation_744,744,question,The effective tax rate was up to 30.6% from 28.6% the prior year.,,,,,,sentence-level event detection,2021-06-10_10:53:19,,earnings call transcript,various,Preliminary_2012_TELSTRA_CORPORATION_LIMITED_Earnings_Presentation
c61f89fc819d52ad7d47da45724ab4aef3e2809a,c61f89fc819d52ad7d47da45724ab4aef3e2809a,a47ecbfd85edf33d7bcd9e6752872cb9c7785504,a47ecbfd85edf33d7bcd9e6752872cb9c7785504,a47ecbfd85edf33d7bcd9e6752872cb9c7785504_745,Preliminary_2012_TELSTRA_CORPORATION_LIMITED_Earnings_Presentation_745,745,question,"Was there any tax impact from the TelstraClear sale and just what's driving that, and where you're at from a franking perspective as well?",,,,,,sentence-level event detection,2021-06-10_10:53:19,,earnings call transcript,various,Preliminary_2012_TELSTRA_CORPORATION_LIMITED_Earnings_Presentation
c61f89fc819d52ad7d47da45724ab4aef3e2809a,c61f89fc819d52ad7d47da45724ab4aef3e2809a,a47ecbfd85edf33d7bcd9e6752872cb9c7785504,a47ecbfd85edf33d7bcd9e6752872cb9c7785504,a47ecbfd85edf33d7bcd9e6752872cb9c7785504_746,Preliminary_2012_TELSTRA_CORPORATION_LIMITED_Earnings_Presentation_746,746,question,"And just following on, on the point around NAS, those contract wins and the ongoing growth in NAS, can we expect to see any pull through in terms of the data and IP side of the business?",,,,,,sentence-level event detection,2021-06-10_10:53:19,,earnings call transcript,various,Preliminary_2012_TELSTRA_CORPORATION_LIMITED_Earnings_Presentation
c61f89fc819d52ad7d47da45724ab4aef3e2809a,c61f89fc819d52ad7d47da45724ab4aef3e2809a,a47ecbfd85edf33d7bcd9e6752872cb9c7785504,a47ecbfd85edf33d7bcd9e6752872cb9c7785504,a47ecbfd85edf33d7bcd9e6752872cb9c7785504_748,Preliminary_2012_TELSTRA_CORPORATION_LIMITED_Earnings_Presentation_748,748,answer,Do you want to just do the --?,,,,,,sentence-level event detection,2021-06-10_10:53:19,,earnings call transcript,various,Preliminary_2012_TELSTRA_CORPORATION_LIMITED_Earnings_Presentation
c61f89fc819d52ad7d47da45724ab4aef3e2809a,c61f89fc819d52ad7d47da45724ab4aef3e2809a,a47ecbfd85edf33d7bcd9e6752872cb9c7785504,a47ecbfd85edf33d7bcd9e6752872cb9c7785504,a47ecbfd85edf33d7bcd9e6752872cb9c7785504_749,Preliminary_2012_TELSTRA_CORPORATION_LIMITED_Earnings_Presentation_749,749,answer,"On the tax one, so no, there's no real impact from the sale of TelstraClear.",,,,,,sentence-level event detection,2021-06-10_10:53:19,,earnings call transcript,various,Preliminary_2012_TELSTRA_CORPORATION_LIMITED_Earnings_Presentation
c61f89fc819d52ad7d47da45724ab4aef3e2809a,c61f89fc819d52ad7d47da45724ab4aef3e2809a,a47ecbfd85edf33d7bcd9e6752872cb9c7785504,a47ecbfd85edf33d7bcd9e6752872cb9c7785504,a47ecbfd85edf33d7bcd9e6752872cb9c7785504_750,Preliminary_2012_TELSTRA_CORPORATION_LIMITED_Earnings_Presentation_750,750,answer,Our franking position is currently negative AUD54 million; you can see that from the statutory accounts.,,,,,,sentence-level event detection,2021-06-10_10:53:19,,earnings call transcript,various,Preliminary_2012_TELSTRA_CORPORATION_LIMITED_Earnings_Presentation
c61f89fc819d52ad7d47da45724ab4aef3e2809a,c61f89fc819d52ad7d47da45724ab4aef3e2809a,a47ecbfd85edf33d7bcd9e6752872cb9c7785504,a47ecbfd85edf33d7bcd9e6752872cb9c7785504,a47ecbfd85edf33d7bcd9e6752872cb9c7785504_751,Preliminary_2012_TELSTRA_CORPORATION_LIMITED_Earnings_Presentation_751,751,answer,"We do have, as you'll see from the balance sheet, a number of tax adjustments to be lodged, which is all really just about making sure we've got the right franking situation.",,,,,,sentence-level event detection,2021-06-10_10:53:19,,earnings call transcript,various,Preliminary_2012_TELSTRA_CORPORATION_LIMITED_Earnings_Presentation
c61f89fc819d52ad7d47da45724ab4aef3e2809a,c61f89fc819d52ad7d47da45724ab4aef3e2809a,a47ecbfd85edf33d7bcd9e6752872cb9c7785504,a47ecbfd85edf33d7bcd9e6752872cb9c7785504,a47ecbfd85edf33d7bcd9e6752872cb9c7785504_752,Preliminary_2012_TELSTRA_CORPORATION_LIMITED_Earnings_Presentation_752,752,answer,"So there's nothing -- there's no systemic change of our tax position, it's just about making sure that the franking right is a negative AUD54 million balance.",,,,,,sentence-level event detection,2021-06-10_10:53:19,,earnings call transcript,various,Preliminary_2012_TELSTRA_CORPORATION_LIMITED_Earnings_Presentation
c61f89fc819d52ad7d47da45724ab4aef3e2809a,c61f89fc819d52ad7d47da45724ab4aef3e2809a,a47ecbfd85edf33d7bcd9e6752872cb9c7785504,a47ecbfd85edf33d7bcd9e6752872cb9c7785504,a47ecbfd85edf33d7bcd9e6752872cb9c7785504_753,Preliminary_2012_TELSTRA_CORPORATION_LIMITED_Earnings_Presentation_753,753,answer,They're outlook is that we're in a position to fully frank the dividend for 2013.,,,,,,sentence-level event detection,2021-06-10_10:53:19,,earnings call transcript,various,Preliminary_2012_TELSTRA_CORPORATION_LIMITED_Earnings_Presentation
c61f89fc819d52ad7d47da45724ab4aef3e2809a,c61f89fc819d52ad7d47da45724ab4aef3e2809a,a47ecbfd85edf33d7bcd9e6752872cb9c7785504,a47ecbfd85edf33d7bcd9e6752872cb9c7785504,a47ecbfd85edf33d7bcd9e6752872cb9c7785504_754,Preliminary_2012_TELSTRA_CORPORATION_LIMITED_Earnings_Presentation_754,754,answer,"And on the NAS question, yes you do see pull through on the IP core access product, so we'll see good growth in that area as we go forward.",,,,,,sentence-level event detection,2021-06-10_10:53:19,,earnings call transcript,various,Preliminary_2012_TELSTRA_CORPORATION_LIMITED_Earnings_Presentation
c61f89fc819d52ad7d47da45724ab4aef3e2809a,c61f89fc819d52ad7d47da45724ab4aef3e2809a,a47ecbfd85edf33d7bcd9e6752872cb9c7785504,a47ecbfd85edf33d7bcd9e6752872cb9c7785504,a47ecbfd85edf33d7bcd9e6752872cb9c7785504_755,Preliminary_2012_TELSTRA_CORPORATION_LIMITED_Earnings_Presentation_755,755,answer,"That's the whole value proposition of that business as you pull through, good next generation carriage revenues.",,,,,,sentence-level event detection,2021-06-10_10:53:19,,earnings call transcript,various,Preliminary_2012_TELSTRA_CORPORATION_LIMITED_Earnings_Presentation
c61f89fc819d52ad7d47da45724ab4aef3e2809a,c61f89fc819d52ad7d47da45724ab4aef3e2809a,a47ecbfd85edf33d7bcd9e6752872cb9c7785504,a47ecbfd85edf33d7bcd9e6752872cb9c7785504,a47ecbfd85edf33d7bcd9e6752872cb9c7785504_756,Preliminary_2012_TELSTRA_CORPORATION_LIMITED_Earnings_Presentation_756,756,question,"Paul Brunker, JPMorgan.",,,,,,sentence-level event detection,2021-06-10_10:53:19,,earnings call transcript,various,Preliminary_2012_TELSTRA_CORPORATION_LIMITED_Earnings_Presentation
c61f89fc819d52ad7d47da45724ab4aef3e2809a,c61f89fc819d52ad7d47da45724ab4aef3e2809a,a47ecbfd85edf33d7bcd9e6752872cb9c7785504,a47ecbfd85edf33d7bcd9e6752872cb9c7785504,a47ecbfd85edf33d7bcd9e6752872cb9c7785504_757,Preliminary_2012_TELSTRA_CORPORATION_LIMITED_Earnings_Presentation_757,757,question,"Just on Mobile margins, there was some degree of slowdown in the second half, as you said, albeit from a high base.",,,,,,sentence-level event detection,2021-06-10_10:53:19,,earnings call transcript,various,Preliminary_2012_TELSTRA_CORPORATION_LIMITED_Earnings_Presentation
c61f89fc819d52ad7d47da45724ab4aef3e2809a,c61f89fc819d52ad7d47da45724ab4aef3e2809a,a47ecbfd85edf33d7bcd9e6752872cb9c7785504,a47ecbfd85edf33d7bcd9e6752872cb9c7785504,a47ecbfd85edf33d7bcd9e6752872cb9c7785504_758,Preliminary_2012_TELSTRA_CORPORATION_LIMITED_Earnings_Presentation_758,758,question,Has that somewhat helped margins through lower subscriber acquisition costs and would you expect SACs to be rising in FY '13 on the iPhone 5?,,,,,,sentence-level event detection,2021-06-10_10:53:19,,earnings call transcript,various,Preliminary_2012_TELSTRA_CORPORATION_LIMITED_Earnings_Presentation
c61f89fc819d52ad7d47da45724ab4aef3e2809a,c61f89fc819d52ad7d47da45724ab4aef3e2809a,a47ecbfd85edf33d7bcd9e6752872cb9c7785504,a47ecbfd85edf33d7bcd9e6752872cb9c7785504,a47ecbfd85edf33d7bcd9e6752872cb9c7785504_759,Preliminary_2012_TELSTRA_CORPORATION_LIMITED_Earnings_Presentation_759,759,question,"And sorry, if I can just sneak another one in on CapEx, your guidance I think refer to the accrued number.",,,,,,sentence-level event detection,2021-06-10_10:53:19,,earnings call transcript,various,Preliminary_2012_TELSTRA_CORPORATION_LIMITED_Earnings_Presentation
c61f89fc819d52ad7d47da45724ab4aef3e2809a,c61f89fc819d52ad7d47da45724ab4aef3e2809a,a47ecbfd85edf33d7bcd9e6752872cb9c7785504,a47ecbfd85edf33d7bcd9e6752872cb9c7785504,a47ecbfd85edf33d7bcd9e6752872cb9c7785504_760,Preliminary_2012_TELSTRA_CORPORATION_LIMITED_Earnings_Presentation_760,760,question,That's about AUD350 million less than the cash CapEx this year.,,,,,,sentence-level event detection,2021-06-10_10:53:19,,earnings call transcript,various,Preliminary_2012_TELSTRA_CORPORATION_LIMITED_Earnings_Presentation
c61f89fc819d52ad7d47da45724ab4aef3e2809a,c61f89fc819d52ad7d47da45724ab4aef3e2809a,a47ecbfd85edf33d7bcd9e6752872cb9c7785504,a47ecbfd85edf33d7bcd9e6752872cb9c7785504,a47ecbfd85edf33d7bcd9e6752872cb9c7785504_761,Preliminary_2012_TELSTRA_CORPORATION_LIMITED_Earnings_Presentation_761,761,question,If you can just clarify why that is and are we right to assume that that gap reverses next year?,,,,,,sentence-level event detection,2021-06-10_10:53:19,,earnings call transcript,various,Preliminary_2012_TELSTRA_CORPORATION_LIMITED_Earnings_Presentation
c61f89fc819d52ad7d47da45724ab4aef3e2809a,c61f89fc819d52ad7d47da45724ab4aef3e2809a,a47ecbfd85edf33d7bcd9e6752872cb9c7785504,a47ecbfd85edf33d7bcd9e6752872cb9c7785504,a47ecbfd85edf33d7bcd9e6752872cb9c7785504_762,Preliminary_2012_TELSTRA_CORPORATION_LIMITED_Earnings_Presentation_762,762,answer,"In terms of your first question on the Mobiles, no, it's not significantly attributable to the increase in margin to SACs, but we are managing it better, I think.",,,,,,sentence-level event detection,2021-06-10_10:53:19,,earnings call transcript,various,Preliminary_2012_TELSTRA_CORPORATION_LIMITED_Earnings_Presentation
c61f89fc819d52ad7d47da45724ab4aef3e2809a,c61f89fc819d52ad7d47da45724ab4aef3e2809a,a47ecbfd85edf33d7bcd9e6752872cb9c7785504,a47ecbfd85edf33d7bcd9e6752872cb9c7785504,a47ecbfd85edf33d7bcd9e6752872cb9c7785504_763,Preliminary_2012_TELSTRA_CORPORATION_LIMITED_Earnings_Presentation_763,763,answer,"And therefore what, [subject] depending on what phones at what time, when we do it, re-contract rates, all those things are really important.",,,,,,sentence-level event detection,2021-06-10_10:53:19,,earnings call transcript,various,Preliminary_2012_TELSTRA_CORPORATION_LIMITED_Earnings_Presentation
c61f89fc819d52ad7d47da45724ab4aef3e2809a,c61f89fc819d52ad7d47da45724ab4aef3e2809a,a47ecbfd85edf33d7bcd9e6752872cb9c7785504,a47ecbfd85edf33d7bcd9e6752872cb9c7785504,a47ecbfd85edf33d7bcd9e6752872cb9c7785504_764,Preliminary_2012_TELSTRA_CORPORATION_LIMITED_Earnings_Presentation_764,764,answer,But it's not significant in terms of the margin; I think it's been just a strong performance across a number of areas.,,,,,,sentence-level event detection,2021-06-10_10:53:19,,earnings call transcript,various,Preliminary_2012_TELSTRA_CORPORATION_LIMITED_Earnings_Presentation
c61f89fc819d52ad7d47da45724ab4aef3e2809a,c61f89fc819d52ad7d47da45724ab4aef3e2809a,a47ecbfd85edf33d7bcd9e6752872cb9c7785504,a47ecbfd85edf33d7bcd9e6752872cb9c7785504,a47ecbfd85edf33d7bcd9e6752872cb9c7785504_765,Preliminary_2012_TELSTRA_CORPORATION_LIMITED_Earnings_Presentation_765,765,answer,"In terms of go forward with the iPhone 5, we do expect a slight increase but over the full year, I think we can manage it pretty well.",,,,,,sentence-level event detection,2021-06-10_10:53:19,,earnings call transcript,various,Preliminary_2012_TELSTRA_CORPORATION_LIMITED_Earnings_Presentation
c61f89fc819d52ad7d47da45724ab4aef3e2809a,c61f89fc819d52ad7d47da45724ab4aef3e2809a,a47ecbfd85edf33d7bcd9e6752872cb9c7785504,a47ecbfd85edf33d7bcd9e6752872cb9c7785504,a47ecbfd85edf33d7bcd9e6752872cb9c7785504_766,Preliminary_2012_TELSTRA_CORPORATION_LIMITED_Earnings_Presentation_766,766,answer,It's still early days on that; we need to get all the details.,,,,,,sentence-level event detection,2021-06-10_10:53:19,,earnings call transcript,various,Preliminary_2012_TELSTRA_CORPORATION_LIMITED_Earnings_Presentation
c61f89fc819d52ad7d47da45724ab4aef3e2809a,c61f89fc819d52ad7d47da45724ab4aef3e2809a,a47ecbfd85edf33d7bcd9e6752872cb9c7785504,a47ecbfd85edf33d7bcd9e6752872cb9c7785504,a47ecbfd85edf33d7bcd9e6752872cb9c7785504_767,Preliminary_2012_TELSTRA_CORPORATION_LIMITED_Earnings_Presentation_767,767,answer,"But as I said, we don't intend to take a step backwards through this process.",,,,,,sentence-level event detection,2021-06-10_10:53:19,,earnings call transcript,various,Preliminary_2012_TELSTRA_CORPORATION_LIMITED_Earnings_Presentation
c61f89fc819d52ad7d47da45724ab4aef3e2809a,c61f89fc819d52ad7d47da45724ab4aef3e2809a,a47ecbfd85edf33d7bcd9e6752872cb9c7785504,a47ecbfd85edf33d7bcd9e6752872cb9c7785504,a47ecbfd85edf33d7bcd9e6752872cb9c7785504_768,Preliminary_2012_TELSTRA_CORPORATION_LIMITED_Earnings_Presentation_768,768,answer,"And I think we've had good experience with the introduction of new phones from Apple now, and there's no question good demand, and where there's demand that's good business.",,,,,,sentence-level event detection,2021-06-10_10:53:19,,earnings call transcript,various,Preliminary_2012_TELSTRA_CORPORATION_LIMITED_Earnings_Presentation
c61f89fc819d52ad7d47da45724ab4aef3e2809a,c61f89fc819d52ad7d47da45724ab4aef3e2809a,a47ecbfd85edf33d7bcd9e6752872cb9c7785504,a47ecbfd85edf33d7bcd9e6752872cb9c7785504,a47ecbfd85edf33d7bcd9e6752872cb9c7785504_769,Preliminary_2012_TELSTRA_CORPORATION_LIMITED_Earnings_Presentation_769,769,answer,"Gordon, do you want to comment anything more?",,,,,,sentence-level event detection,2021-06-10_10:53:19,,earnings call transcript,various,Preliminary_2012_TELSTRA_CORPORATION_LIMITED_Earnings_Presentation
c61f89fc819d52ad7d47da45724ab4aef3e2809a,c61f89fc819d52ad7d47da45724ab4aef3e2809a,a47ecbfd85edf33d7bcd9e6752872cb9c7785504,a47ecbfd85edf33d7bcd9e6752872cb9c7785504,a47ecbfd85edf33d7bcd9e6752872cb9c7785504_770,Preliminary_2012_TELSTRA_CORPORATION_LIMITED_Earnings_Presentation_770,770,answer,"The only thing I'd say is one of the great shifts we've achieved this financial year is the quality of the mix of customers we're bringing on board, given the quality of the network and introduction of LTE where we see, if you look to year ago, we would have had, for price plans below AUD59, we would have had about -- in FY '11 we had about 34% of our customers above the AUD59 price point and above.",,,,,,sentence-level event detection,2021-06-10_10:53:19,,earnings call transcript,various,Preliminary_2012_TELSTRA_CORPORATION_LIMITED_Earnings_Presentation
c61f89fc819d52ad7d47da45724ab4aef3e2809a,c61f89fc819d52ad7d47da45724ab4aef3e2809a,a47ecbfd85edf33d7bcd9e6752872cb9c7785504,a47ecbfd85edf33d7bcd9e6752872cb9c7785504,a47ecbfd85edf33d7bcd9e6752872cb9c7785504_771,Preliminary_2012_TELSTRA_CORPORATION_LIMITED_Earnings_Presentation_771,771,answer,"If we look at FY '12, we're now at about 71%, so what we see is an improvement in quality of customer.",,,,,,sentence-level event detection,2021-06-10_10:53:19,,earnings call transcript,various,Preliminary_2012_TELSTRA_CORPORATION_LIMITED_Earnings_Presentation
c61f89fc819d52ad7d47da45724ab4aef3e2809a,c61f89fc819d52ad7d47da45724ab4aef3e2809a,a47ecbfd85edf33d7bcd9e6752872cb9c7785504,a47ecbfd85edf33d7bcd9e6752872cb9c7785504,a47ecbfd85edf33d7bcd9e6752872cb9c7785504_772,Preliminary_2012_TELSTRA_CORPORATION_LIMITED_Earnings_Presentation_772,772,answer,What we see is an improvement in the quality of the mix and the plan mix.,,,,,,sentence-level event detection,2021-06-10_10:53:19,,earnings call transcript,various,Preliminary_2012_TELSTRA_CORPORATION_LIMITED_Earnings_Presentation
c61f89fc819d52ad7d47da45724ab4aef3e2809a,c61f89fc819d52ad7d47da45724ab4aef3e2809a,a47ecbfd85edf33d7bcd9e6752872cb9c7785504,a47ecbfd85edf33d7bcd9e6752872cb9c7785504,a47ecbfd85edf33d7bcd9e6752872cb9c7785504_773,Preliminary_2012_TELSTRA_CORPORATION_LIMITED_Earnings_Presentation_773,773,answer,We're seeing an improvement in the usage and customers wanting more inclusions because they're using data more.,,,,,,sentence-level event detection,2021-06-10_10:53:19,,earnings call transcript,various,Preliminary_2012_TELSTRA_CORPORATION_LIMITED_Earnings_Presentation
c61f89fc819d52ad7d47da45724ab4aef3e2809a,c61f89fc819d52ad7d47da45724ab4aef3e2809a,a47ecbfd85edf33d7bcd9e6752872cb9c7785504,a47ecbfd85edf33d7bcd9e6752872cb9c7785504,a47ecbfd85edf33d7bcd9e6752872cb9c7785504_774,Preliminary_2012_TELSTRA_CORPORATION_LIMITED_Earnings_Presentation_774,774,answer,"And we're beginning to monetize that and that, actually, is reaping greater margin improvement and we don't see that abating.",,,,,,sentence-level event detection,2021-06-10_10:53:19,,earnings call transcript,various,Preliminary_2012_TELSTRA_CORPORATION_LIMITED_Earnings_Presentation
c61f89fc819d52ad7d47da45724ab4aef3e2809a,c61f89fc819d52ad7d47da45724ab4aef3e2809a,a47ecbfd85edf33d7bcd9e6752872cb9c7785504,a47ecbfd85edf33d7bcd9e6752872cb9c7785504,a47ecbfd85edf33d7bcd9e6752872cb9c7785504_775,Preliminary_2012_TELSTRA_CORPORATION_LIMITED_Earnings_Presentation_775,775,answer,"So that's why the margin improvement is sustainable, notwithstanding as we shift to a year of re-contracting with the launch of iPhone 5.",,,,,,sentence-level event detection,2021-06-10_10:53:19,,earnings call transcript,various,Preliminary_2012_TELSTRA_CORPORATION_LIMITED_Earnings_Presentation
c61f89fc819d52ad7d47da45724ab4aef3e2809a,c61f89fc819d52ad7d47da45724ab4aef3e2809a,a47ecbfd85edf33d7bcd9e6752872cb9c7785504,a47ecbfd85edf33d7bcd9e6752872cb9c7785504,a47ecbfd85edf33d7bcd9e6752872cb9c7785504_776,Preliminary_2012_TELSTRA_CORPORATION_LIMITED_Earnings_Presentation_776,776,answer,So that's a positive trend that we want to --,,,,,,sentence-level event detection,2021-06-10_10:53:19,,earnings call transcript,various,Preliminary_2012_TELSTRA_CORPORATION_LIMITED_Earnings_Presentation
c61f89fc819d52ad7d47da45724ab4aef3e2809a,c61f89fc819d52ad7d47da45724ab4aef3e2809a,a47ecbfd85edf33d7bcd9e6752872cb9c7785504,a47ecbfd85edf33d7bcd9e6752872cb9c7785504,a47ecbfd85edf33d7bcd9e6752872cb9c7785504_778,Preliminary_2012_TELSTRA_CORPORATION_LIMITED_Earnings_Presentation_778,778,answer,And (inaudible) question?,,,,,,sentence-level event detection,2021-06-10_10:53:19,,earnings call transcript,various,Preliminary_2012_TELSTRA_CORPORATION_LIMITED_Earnings_Presentation
c61f89fc819d52ad7d47da45724ab4aef3e2809a,c61f89fc819d52ad7d47da45724ab4aef3e2809a,a47ecbfd85edf33d7bcd9e6752872cb9c7785504,a47ecbfd85edf33d7bcd9e6752872cb9c7785504,a47ecbfd85edf33d7bcd9e6752872cb9c7785504_779,Preliminary_2012_TELSTRA_CORPORATION_LIMITED_Earnings_Presentation_779,779,answer,I must just get Mark Hall to answer the question on (multiple speakers) and cash CapEx.,,,,,,sentence-level event detection,2021-06-10_10:53:19,,earnings call transcript,various,Preliminary_2012_TELSTRA_CORPORATION_LIMITED_Earnings_Presentation
c61f89fc819d52ad7d47da45724ab4aef3e2809a,c61f89fc819d52ad7d47da45724ab4aef3e2809a,a47ecbfd85edf33d7bcd9e6752872cb9c7785504,a47ecbfd85edf33d7bcd9e6752872cb9c7785504,a47ecbfd85edf33d7bcd9e6752872cb9c7785504_781,Preliminary_2012_TELSTRA_CORPORATION_LIMITED_Earnings_Presentation_781,781,answer,"On CapEx I mentioned at the half that in the past we've had a program that ramps up during the course of the year, so obviously, the cash impact of that spills over into the following year.",,,,,,sentence-level event detection,2021-06-10_10:53:19,,earnings call transcript,various,Preliminary_2012_TELSTRA_CORPORATION_LIMITED_Earnings_Presentation
c61f89fc819d52ad7d47da45724ab4aef3e2809a,c61f89fc819d52ad7d47da45724ab4aef3e2809a,a47ecbfd85edf33d7bcd9e6752872cb9c7785504,a47ecbfd85edf33d7bcd9e6752872cb9c7785504,a47ecbfd85edf33d7bcd9e6752872cb9c7785504_782,Preliminary_2012_TELSTRA_CORPORATION_LIMITED_Earnings_Presentation_782,782,answer,"What we've had this year is a program managed on a far more flatter basis, i.e., even keel across the year, so we don't have that same impact and we'd expect that to continue, going forward.",,,,,,sentence-level event detection,2021-06-10_10:53:19,,earnings call transcript,various,Preliminary_2012_TELSTRA_CORPORATION_LIMITED_Earnings_Presentation
c61f89fc819d52ad7d47da45724ab4aef3e2809a,c61f89fc819d52ad7d47da45724ab4aef3e2809a,a47ecbfd85edf33d7bcd9e6752872cb9c7785504,a47ecbfd85edf33d7bcd9e6752872cb9c7785504,a47ecbfd85edf33d7bcd9e6752872cb9c7785504_784,Preliminary_2012_TELSTRA_CORPORATION_LIMITED_Earnings_Presentation_784,784,answer,I think that's all the questions we have time today.,,,,,,sentence-level event detection,2021-06-10_10:53:19,,earnings call transcript,various,Preliminary_2012_TELSTRA_CORPORATION_LIMITED_Earnings_Presentation
c61f89fc819d52ad7d47da45724ab4aef3e2809a,c61f89fc819d52ad7d47da45724ab4aef3e2809a,a47ecbfd85edf33d7bcd9e6752872cb9c7785504,a47ecbfd85edf33d7bcd9e6752872cb9c7785504,a47ecbfd85edf33d7bcd9e6752872cb9c7785504_785,Preliminary_2012_TELSTRA_CORPORATION_LIMITED_Earnings_Presentation_785,785,answer,I'll just over to David for any closing words then we'll close.,,,,,,sentence-level event detection,2021-06-10_10:53:19,,earnings call transcript,various,Preliminary_2012_TELSTRA_CORPORATION_LIMITED_Earnings_Presentation
c61f89fc819d52ad7d47da45724ab4aef3e2809a,c61f89fc819d52ad7d47da45724ab4aef3e2809a,a47ecbfd85edf33d7bcd9e6752872cb9c7785504,a47ecbfd85edf33d7bcd9e6752872cb9c7785504,a47ecbfd85edf33d7bcd9e6752872cb9c7785504_787,Preliminary_2012_TELSTRA_CORPORATION_LIMITED_Earnings_Presentation_787,787,answer,"Thank, Ben.",,,,,,sentence-level event detection,2021-06-10_10:53:19,,earnings call transcript,various,Preliminary_2012_TELSTRA_CORPORATION_LIMITED_Earnings_Presentation
c61f89fc819d52ad7d47da45724ab4aef3e2809a,c61f89fc819d52ad7d47da45724ab4aef3e2809a,a47ecbfd85edf33d7bcd9e6752872cb9c7785504,a47ecbfd85edf33d7bcd9e6752872cb9c7785504,a47ecbfd85edf33d7bcd9e6752872cb9c7785504_788,Preliminary_2012_TELSTRA_CORPORATION_LIMITED_Earnings_Presentation_788,788,answer,I don't have a whole lot to say.,,,,,,sentence-level event detection,2021-06-10_10:53:19,,earnings call transcript,various,Preliminary_2012_TELSTRA_CORPORATION_LIMITED_Earnings_Presentation
c61f89fc819d52ad7d47da45724ab4aef3e2809a,c61f89fc819d52ad7d47da45724ab4aef3e2809a,a47ecbfd85edf33d7bcd9e6752872cb9c7785504,a47ecbfd85edf33d7bcd9e6752872cb9c7785504,a47ecbfd85edf33d7bcd9e6752872cb9c7785504_789,Preliminary_2012_TELSTRA_CORPORATION_LIMITED_Earnings_Presentation_789,789,answer,It's been a strong year's results.,,,,,,sentence-level event detection,2021-06-10_10:53:19,,earnings call transcript,various,Preliminary_2012_TELSTRA_CORPORATION_LIMITED_Earnings_Presentation
c61f89fc819d52ad7d47da45724ab4aef3e2809a,c61f89fc819d52ad7d47da45724ab4aef3e2809a,a47ecbfd85edf33d7bcd9e6752872cb9c7785504,a47ecbfd85edf33d7bcd9e6752872cb9c7785504,a47ecbfd85edf33d7bcd9e6752872cb9c7785504_790,Preliminary_2012_TELSTRA_CORPORATION_LIMITED_Earnings_Presentation_790,790,answer,"We're looking forward to this year, [and full year '13].",,,,,,sentence-level event detection,2021-06-10_10:53:19,,earnings call transcript,various,Preliminary_2012_TELSTRA_CORPORATION_LIMITED_Earnings_Presentation
c61f89fc819d52ad7d47da45724ab4aef3e2809a,c61f89fc819d52ad7d47da45724ab4aef3e2809a,a47ecbfd85edf33d7bcd9e6752872cb9c7785504,a47ecbfd85edf33d7bcd9e6752872cb9c7785504,a47ecbfd85edf33d7bcd9e6752872cb9c7785504_791,Preliminary_2012_TELSTRA_CORPORATION_LIMITED_Earnings_Presentation_791,791,answer,I think we've got good momentum.,,,,,,sentence-level event detection,2021-06-10_10:53:19,,earnings call transcript,various,Preliminary_2012_TELSTRA_CORPORATION_LIMITED_Earnings_Presentation
