BATCH_ID,BATCH_UUID,DOCUMENT_UUID,FILE_UUID,TEXT_UUID,TEXT_ID,ROW_ID,SECTION,TEXT,LABEL,LABEL2,LABEL3,COMMENTS,ANNOTATOR_ID,TASK,TIMESTAMP_DELIVERED_TO_VENDOR,TIMESTAMP_VENDOR_DELIVERY,DOCUMENT_TYPE,SECTOR,SOURCE_DOCUMENT_URI
c61f89fc819d52ad7d47da45724ab4aef3e2809a,c61f89fc819d52ad7d47da45724ab4aef3e2809a,a47ecbfd85edf33d7bcd9e6752872cb9c7785504,a47ecbfd85edf33d7bcd9e6752872cb9c7785504,a47ecbfd85edf33d7bcd9e6752872cb9c7785504_267,Preliminary_2012_TELSTRA_CORPORATION_LIMITED_Earnings_Presentation_267,267,presentation,"Third area, simplifying the business.",,,,,,sentence-level event detection,2021-06-10_10:53:19,,earnings call transcript,various,Preliminary_2012_TELSTRA_CORPORATION_LIMITED_Earnings_Presentation
c61f89fc819d52ad7d47da45724ab4aef3e2809a,c61f89fc819d52ad7d47da45724ab4aef3e2809a,a47ecbfd85edf33d7bcd9e6752872cb9c7785504,a47ecbfd85edf33d7bcd9e6752872cb9c7785504,a47ecbfd85edf33d7bcd9e6752872cb9c7785504_268,Preliminary_2012_TELSTRA_CORPORATION_LIMITED_Earnings_Presentation_268,268,presentation,"This remains, and will always remain, a critical part of what we need to do.",,,,,,sentence-level event detection,2021-06-10_10:53:19,,earnings call transcript,various,Preliminary_2012_TELSTRA_CORPORATION_LIMITED_Earnings_Presentation
c61f89fc819d52ad7d47da45724ab4aef3e2809a,c61f89fc819d52ad7d47da45724ab4aef3e2809a,a47ecbfd85edf33d7bcd9e6752872cb9c7785504,a47ecbfd85edf33d7bcd9e6752872cb9c7785504,a47ecbfd85edf33d7bcd9e6752872cb9c7785504_269,Preliminary_2012_TELSTRA_CORPORATION_LIMITED_Earnings_Presentation_269,269,presentation,"Very importantly, we have seen this year a decline in our labor and labor substitution costs, and this has been driven by all the simplification efforts, productivity improvements, we're driving right across the business.",,,,,,sentence-level event detection,2021-06-10_10:53:19,,earnings call transcript,various,Preliminary_2012_TELSTRA_CORPORATION_LIMITED_Earnings_Presentation
c61f89fc819d52ad7d47da45724ab4aef3e2809a,c61f89fc819d52ad7d47da45724ab4aef3e2809a,a47ecbfd85edf33d7bcd9e6752872cb9c7785504,a47ecbfd85edf33d7bcd9e6752872cb9c7785504,a47ecbfd85edf33d7bcd9e6752872cb9c7785504_270,Preliminary_2012_TELSTRA_CORPORATION_LIMITED_Earnings_Presentation_270,270,presentation,"Now, I want to put this into context.",,,,,,sentence-level event detection,2021-06-10_10:53:19,,earnings call transcript,various,Preliminary_2012_TELSTRA_CORPORATION_LIMITED_Earnings_Presentation
c61f89fc819d52ad7d47da45724ab4aef3e2809a,c61f89fc819d52ad7d47da45724ab4aef3e2809a,a47ecbfd85edf33d7bcd9e6752872cb9c7785504,a47ecbfd85edf33d7bcd9e6752872cb9c7785504,a47ecbfd85edf33d7bcd9e6752872cb9c7785504_271,Preliminary_2012_TELSTRA_CORPORATION_LIMITED_Earnings_Presentation_271,271,presentation,"To drive a 1.8% decline in our labor and labor sub costs, while demand is growing, and we're trying to improve customers satisfaction, is really a very strong result.",,,,,,sentence-level event detection,2021-06-10_10:53:19,,earnings call transcript,various,Preliminary_2012_TELSTRA_CORPORATION_LIMITED_Earnings_Presentation
c61f89fc819d52ad7d47da45724ab4aef3e2809a,c61f89fc819d52ad7d47da45724ab4aef3e2809a,a47ecbfd85edf33d7bcd9e6752872cb9c7785504,a47ecbfd85edf33d7bcd9e6752872cb9c7785504,a47ecbfd85edf33d7bcd9e6752872cb9c7785504_272,Preliminary_2012_TELSTRA_CORPORATION_LIMITED_Earnings_Presentation_272,272,presentation,"And it is testament of the incredible dedication of our staff, right across the Company.",,,,,,sentence-level event detection,2021-06-10_10:53:19,,earnings call transcript,various,Preliminary_2012_TELSTRA_CORPORATION_LIMITED_Earnings_Presentation
c61f89fc819d52ad7d47da45724ab4aef3e2809a,c61f89fc819d52ad7d47da45724ab4aef3e2809a,a47ecbfd85edf33d7bcd9e6752872cb9c7785504,a47ecbfd85edf33d7bcd9e6752872cb9c7785504,a47ecbfd85edf33d7bcd9e6752872cb9c7785504_273,Preliminary_2012_TELSTRA_CORPORATION_LIMITED_Earnings_Presentation_273,273,presentation,"This is difficult to do, because volumes are up, and you've got to do things differently if you're going to be able to deliver that sort of productivity.",,,,,,sentence-level event detection,2021-06-10_10:53:19,,earnings call transcript,various,Preliminary_2012_TELSTRA_CORPORATION_LIMITED_Earnings_Presentation
c61f89fc819d52ad7d47da45724ab4aef3e2809a,c61f89fc819d52ad7d47da45724ab4aef3e2809a,a47ecbfd85edf33d7bcd9e6752872cb9c7785504,a47ecbfd85edf33d7bcd9e6752872cb9c7785504,a47ecbfd85edf33d7bcd9e6752872cb9c7785504_274,Preliminary_2012_TELSTRA_CORPORATION_LIMITED_Earnings_Presentation_274,274,presentation,"AUD1.1 billion in productivity benefits across the business, at a gross level, but that gives us the freedom to reinvest in new growth areas, move our resources to the new growth areas.",,,,,,sentence-level event detection,2021-06-10_10:53:19,,earnings call transcript,various,Preliminary_2012_TELSTRA_CORPORATION_LIMITED_Earnings_Presentation
c61f89fc819d52ad7d47da45724ab4aef3e2809a,c61f89fc819d52ad7d47da45724ab4aef3e2809a,a47ecbfd85edf33d7bcd9e6752872cb9c7785504,a47ecbfd85edf33d7bcd9e6752872cb9c7785504,a47ecbfd85edf33d7bcd9e6752872cb9c7785504_275,Preliminary_2012_TELSTRA_CORPORATION_LIMITED_Earnings_Presentation_275,275,presentation,"And this will continue to be a critical part of what we need to do, as we go forward.",,,,,,sentence-level event detection,2021-06-10_10:53:19,,earnings call transcript,various,Preliminary_2012_TELSTRA_CORPORATION_LIMITED_Earnings_Presentation
c61f89fc819d52ad7d47da45724ab4aef3e2809a,c61f89fc819d52ad7d47da45724ab4aef3e2809a,a47ecbfd85edf33d7bcd9e6752872cb9c7785504,a47ecbfd85edf33d7bcd9e6752872cb9c7785504,a47ecbfd85edf33d7bcd9e6752872cb9c7785504_276,Preliminary_2012_TELSTRA_CORPORATION_LIMITED_Earnings_Presentation_276,276,presentation,Some interesting statistics; now 1.6 million access their bill digitally; that's whether they get a PDF one which is sent to them by e-mail or they access it on-line.,,,,,,sentence-level event detection,2021-06-10_10:53:19,,earnings call transcript,various,Preliminary_2012_TELSTRA_CORPORATION_LIMITED_Earnings_Presentation
c61f89fc819d52ad7d47da45724ab4aef3e2809a,c61f89fc819d52ad7d47da45724ab4aef3e2809a,a47ecbfd85edf33d7bcd9e6752872cb9c7785504,a47ecbfd85edf33d7bcd9e6752872cb9c7785504,a47ecbfd85edf33d7bcd9e6752872cb9c7785504_277,Preliminary_2012_TELSTRA_CORPORATION_LIMITED_Earnings_Presentation_277,277,presentation,"1 million customers have registered for direct debit, and we now receive over AUD100 million in online bill payments each month.",,,,,,sentence-level event detection,2021-06-10_10:53:19,,earnings call transcript,various,Preliminary_2012_TELSTRA_CORPORATION_LIMITED_Earnings_Presentation
c61f89fc819d52ad7d47da45724ab4aef3e2809a,c61f89fc819d52ad7d47da45724ab4aef3e2809a,a47ecbfd85edf33d7bcd9e6752872cb9c7785504,a47ecbfd85edf33d7bcd9e6752872cb9c7785504,a47ecbfd85edf33d7bcd9e6752872cb9c7785504_278,Preliminary_2012_TELSTRA_CORPORATION_LIMITED_Earnings_Presentation_278,278,presentation,"These are really big changes, and have shown really significant growth over the last 12 months.",,,,,,sentence-level event detection,2021-06-10_10:53:19,,earnings call transcript,various,Preliminary_2012_TELSTRA_CORPORATION_LIMITED_Earnings_Presentation
c61f89fc819d52ad7d47da45724ab4aef3e2809a,c61f89fc819d52ad7d47da45724ab4aef3e2809a,a47ecbfd85edf33d7bcd9e6752872cb9c7785504,a47ecbfd85edf33d7bcd9e6752872cb9c7785504,a47ecbfd85edf33d7bcd9e6752872cb9c7785504_279,Preliminary_2012_TELSTRA_CORPORATION_LIMITED_Earnings_Presentation_279,279,presentation,"Even the new online shop, which if you haven't tried it you should, it's a really great experience.",,,,,,sentence-level event detection,2021-06-10_10:53:19,,earnings call transcript,various,Preliminary_2012_TELSTRA_CORPORATION_LIMITED_Earnings_Presentation
c61f89fc819d52ad7d47da45724ab4aef3e2809a,c61f89fc819d52ad7d47da45724ab4aef3e2809a,a47ecbfd85edf33d7bcd9e6752872cb9c7785504,a47ecbfd85edf33d7bcd9e6752872cb9c7785504,a47ecbfd85edf33d7bcd9e6752872cb9c7785504_280,Preliminary_2012_TELSTRA_CORPORATION_LIMITED_Earnings_Presentation_280,280,presentation,"It's simple, easy to use, and that's how people are wanting to purchase.",,,,,,sentence-level event detection,2021-06-10_10:53:19,,earnings call transcript,various,Preliminary_2012_TELSTRA_CORPORATION_LIMITED_Earnings_Presentation
c61f89fc819d52ad7d47da45724ab4aef3e2809a,c61f89fc819d52ad7d47da45724ab4aef3e2809a,a47ecbfd85edf33d7bcd9e6752872cb9c7785504,a47ecbfd85edf33d7bcd9e6752872cb9c7785504,a47ecbfd85edf33d7bcd9e6752872cb9c7785504_281,Preliminary_2012_TELSTRA_CORPORATION_LIMITED_Earnings_Presentation_281,281,presentation,"And I mentioned before some of the new ways we're interacting with customers round Livechat, being on social media sites, it's really exciting to see the changes.",,,,,,sentence-level event detection,2021-06-10_10:53:19,,earnings call transcript,various,Preliminary_2012_TELSTRA_CORPORATION_LIMITED_Earnings_Presentation
c61f89fc819d52ad7d47da45724ab4aef3e2809a,c61f89fc819d52ad7d47da45724ab4aef3e2809a,a47ecbfd85edf33d7bcd9e6752872cb9c7785504,a47ecbfd85edf33d7bcd9e6752872cb9c7785504,a47ecbfd85edf33d7bcd9e6752872cb9c7785504_282,Preliminary_2012_TELSTRA_CORPORATION_LIMITED_Earnings_Presentation_282,282,presentation,But we've only just begun.,,,,,,sentence-level event detection,2021-06-10_10:53:19,,earnings call transcript,various,Preliminary_2012_TELSTRA_CORPORATION_LIMITED_Earnings_Presentation
c61f89fc819d52ad7d47da45724ab4aef3e2809a,c61f89fc819d52ad7d47da45724ab4aef3e2809a,a47ecbfd85edf33d7bcd9e6752872cb9c7785504,a47ecbfd85edf33d7bcd9e6752872cb9c7785504,a47ecbfd85edf33d7bcd9e6752872cb9c7785504_283,Preliminary_2012_TELSTRA_CORPORATION_LIMITED_Earnings_Presentation_283,283,presentation,"We see really quite significant change over the next five years, as we really change the way we run the business to really be a digitally-led Company.",,,,,,sentence-level event detection,2021-06-10_10:53:19,,earnings call transcript,various,Preliminary_2012_TELSTRA_CORPORATION_LIMITED_Earnings_Presentation
c61f89fc819d52ad7d47da45724ab4aef3e2809a,c61f89fc819d52ad7d47da45724ab4aef3e2809a,a47ecbfd85edf33d7bcd9e6752872cb9c7785504,a47ecbfd85edf33d7bcd9e6752872cb9c7785504,a47ecbfd85edf33d7bcd9e6752872cb9c7785504_284,Preliminary_2012_TELSTRA_CORPORATION_LIMITED_Earnings_Presentation_284,284,presentation,"Now that's hard for a legacy -- a big corporation like Telstra, but we're making really good progress.",,,,,,sentence-level event detection,2021-06-10_10:53:19,,earnings call transcript,various,Preliminary_2012_TELSTRA_CORPORATION_LIMITED_Earnings_Presentation
c61f89fc819d52ad7d47da45724ab4aef3e2809a,c61f89fc819d52ad7d47da45724ab4aef3e2809a,a47ecbfd85edf33d7bcd9e6752872cb9c7785504,a47ecbfd85edf33d7bcd9e6752872cb9c7785504,a47ecbfd85edf33d7bcd9e6752872cb9c7785504_285,Preliminary_2012_TELSTRA_CORPORATION_LIMITED_Earnings_Presentation_285,285,presentation,"And then, of course, the fourth are is around our growth businesses.",,,,,,sentence-level event detection,2021-06-10_10:53:19,,earnings call transcript,various,Preliminary_2012_TELSTRA_CORPORATION_LIMITED_Earnings_Presentation
c61f89fc819d52ad7d47da45724ab4aef3e2809a,c61f89fc819d52ad7d47da45724ab4aef3e2809a,a47ecbfd85edf33d7bcd9e6752872cb9c7785504,a47ecbfd85edf33d7bcd9e6752872cb9c7785504,a47ecbfd85edf33d7bcd9e6752872cb9c7785504_286,Preliminary_2012_TELSTRA_CORPORATION_LIMITED_Earnings_Presentation_286,286,presentation,"Every element of that strategy's so important; Media, Asia, and Network Apps & Services, because these initiatives are really adjacencies.",,,,,,sentence-level event detection,2021-06-10_10:53:19,,earnings call transcript,various,Preliminary_2012_TELSTRA_CORPORATION_LIMITED_Earnings_Presentation
c61f89fc819d52ad7d47da45724ab4aef3e2809a,c61f89fc819d52ad7d47da45724ab4aef3e2809a,a47ecbfd85edf33d7bcd9e6752872cb9c7785504,a47ecbfd85edf33d7bcd9e6752872cb9c7785504,a47ecbfd85edf33d7bcd9e6752872cb9c7785504_287,Preliminary_2012_TELSTRA_CORPORATION_LIMITED_Earnings_Presentation_287,287,presentation,"They complement our core business, and if you can get it right, you both grow into new areas while still pulling through a lot of your core offerings in the market.",,,,,,sentence-level event detection,2021-06-10_10:53:19,,earnings call transcript,various,Preliminary_2012_TELSTRA_CORPORATION_LIMITED_Earnings_Presentation
c61f89fc819d52ad7d47da45724ab4aef3e2809a,c61f89fc819d52ad7d47da45724ab4aef3e2809a,a47ecbfd85edf33d7bcd9e6752872cb9c7785504,a47ecbfd85edf33d7bcd9e6752872cb9c7785504,a47ecbfd85edf33d7bcd9e6752872cb9c7785504_288,Preliminary_2012_TELSTRA_CORPORATION_LIMITED_Earnings_Presentation_288,288,presentation,So let me go through each one of those.,,,,,,sentence-level event detection,2021-06-10_10:53:19,,earnings call transcript,various,Preliminary_2012_TELSTRA_CORPORATION_LIMITED_Earnings_Presentation
c61f89fc819d52ad7d47da45724ab4aef3e2809a,c61f89fc819d52ad7d47da45724ab4aef3e2809a,a47ecbfd85edf33d7bcd9e6752872cb9c7785504,a47ecbfd85edf33d7bcd9e6752872cb9c7785504,a47ecbfd85edf33d7bcd9e6752872cb9c7785504_289,Preliminary_2012_TELSTRA_CORPORATION_LIMITED_Earnings_Presentation_289,289,presentation,"Under the umbrella of our Media businesses, we recently announced some quite exciting new niches, with a company like MOG, which is a next-generation music company.",,,,,,sentence-level event detection,2021-06-10_10:53:19,,earnings call transcript,various,Preliminary_2012_TELSTRA_CORPORATION_LIMITED_Earnings_Presentation
c61f89fc819d52ad7d47da45724ab4aef3e2809a,c61f89fc819d52ad7d47da45724ab4aef3e2809a,a47ecbfd85edf33d7bcd9e6752872cb9c7785504,a47ecbfd85edf33d7bcd9e6752872cb9c7785504,a47ecbfd85edf33d7bcd9e6752872cb9c7785504_290,Preliminary_2012_TELSTRA_CORPORATION_LIMITED_Earnings_Presentation_290,290,presentation,"It's a partnership, and we think that this sort of partnership of innovation is going to be very important for us in the future.",,,,,,sentence-level event detection,2021-06-10_10:53:19,,earnings call transcript,various,Preliminary_2012_TELSTRA_CORPORATION_LIMITED_Earnings_Presentation
c61f89fc819d52ad7d47da45724ab4aef3e2809a,c61f89fc819d52ad7d47da45724ab4aef3e2809a,a47ecbfd85edf33d7bcd9e6752872cb9c7785504,a47ecbfd85edf33d7bcd9e6752872cb9c7785504,a47ecbfd85edf33d7bcd9e6752872cb9c7785504_291,Preliminary_2012_TELSTRA_CORPORATION_LIMITED_Earnings_Presentation_291,291,presentation,"That particular one delivers really good music services on smartphones, tablets and wireless hi-fi systems, but again, a great example of using innovation to really differentiate our offerings.",,,,,,sentence-level event detection,2021-06-10_10:53:19,,earnings call transcript,various,Preliminary_2012_TELSTRA_CORPORATION_LIMITED_Earnings_Presentation
c61f89fc819d52ad7d47da45724ab4aef3e2809a,c61f89fc819d52ad7d47da45724ab4aef3e2809a,a47ecbfd85edf33d7bcd9e6752872cb9c7785504,a47ecbfd85edf33d7bcd9e6752872cb9c7785504,a47ecbfd85edf33d7bcd9e6752872cb9c7785504_292,Preliminary_2012_TELSTRA_CORPORATION_LIMITED_Earnings_Presentation_292,292,presentation,We think that partnering will be a critical part of the way we go forward.,,,,,,sentence-level event detection,2021-06-10_10:53:19,,earnings call transcript,various,Preliminary_2012_TELSTRA_CORPORATION_LIMITED_Earnings_Presentation
c61f89fc819d52ad7d47da45724ab4aef3e2809a,c61f89fc819d52ad7d47da45724ab4aef3e2809a,a47ecbfd85edf33d7bcd9e6752872cb9c7785504,a47ecbfd85edf33d7bcd9e6752872cb9c7785504,a47ecbfd85edf33d7bcd9e6752872cb9c7785504_293,Preliminary_2012_TELSTRA_CORPORATION_LIMITED_Earnings_Presentation_293,293,presentation,"Also, the acquisition by Foxtel of Austar was a key part of this growth strategy.",,,,,,sentence-level event detection,2021-06-10_10:53:19,,earnings call transcript,various,Preliminary_2012_TELSTRA_CORPORATION_LIMITED_Earnings_Presentation
c61f89fc819d52ad7d47da45724ab4aef3e2809a,c61f89fc819d52ad7d47da45724ab4aef3e2809a,a47ecbfd85edf33d7bcd9e6752872cb9c7785504,a47ecbfd85edf33d7bcd9e6752872cb9c7785504,a47ecbfd85edf33d7bcd9e6752872cb9c7785504_294,Preliminary_2012_TELSTRA_CORPORATION_LIMITED_Earnings_Presentation_294,294,presentation,"Also, the IPTV business is going well, and as you know, we announced a new executive to run that business, who's had deep media experience and has worked with (inaudible) previously before.",,,,,,sentence-level event detection,2021-06-10_10:53:19,,earnings call transcript,various,Preliminary_2012_TELSTRA_CORPORATION_LIMITED_Earnings_Presentation
c61f89fc819d52ad7d47da45724ab4aef3e2809a,c61f89fc819d52ad7d47da45724ab4aef3e2809a,a47ecbfd85edf33d7bcd9e6752872cb9c7785504,a47ecbfd85edf33d7bcd9e6752872cb9c7785504,a47ecbfd85edf33d7bcd9e6752872cb9c7785504_295,Preliminary_2012_TELSTRA_CORPORATION_LIMITED_Earnings_Presentation_295,295,presentation,And we think that IPTV does play a very important part of the media landscape in the future.,,,,,,sentence-level event detection,2021-06-10_10:53:19,,earnings call transcript,various,Preliminary_2012_TELSTRA_CORPORATION_LIMITED_Earnings_Presentation
c61f89fc819d52ad7d47da45724ab4aef3e2809a,c61f89fc819d52ad7d47da45724ab4aef3e2809a,a47ecbfd85edf33d7bcd9e6752872cb9c7785504,a47ecbfd85edf33d7bcd9e6752872cb9c7785504,a47ecbfd85edf33d7bcd9e6752872cb9c7785504_296,Preliminary_2012_TELSTRA_CORPORATION_LIMITED_Earnings_Presentation_296,296,presentation,"I'm not saying it's everything, but it's a very critical part of where we're going in the future.",,,,,,sentence-level event detection,2021-06-10_10:53:19,,earnings call transcript,various,Preliminary_2012_TELSTRA_CORPORATION_LIMITED_Earnings_Presentation
c61f89fc819d52ad7d47da45724ab4aef3e2809a,c61f89fc819d52ad7d47da45724ab4aef3e2809a,a47ecbfd85edf33d7bcd9e6752872cb9c7785504,a47ecbfd85edf33d7bcd9e6752872cb9c7785504,a47ecbfd85edf33d7bcd9e6752872cb9c7785504_297,Preliminary_2012_TELSTRA_CORPORATION_LIMITED_Earnings_Presentation_297,297,presentation,"I'll come back to Sensis, because I've got a separate chart on Sensis; I want to give you a little bit of color about how that's going.",,,,,,sentence-level event detection,2021-06-10_10:53:19,,earnings call transcript,various,Preliminary_2012_TELSTRA_CORPORATION_LIMITED_Earnings_Presentation
c61f89fc819d52ad7d47da45724ab4aef3e2809a,c61f89fc819d52ad7d47da45724ab4aef3e2809a,a47ecbfd85edf33d7bcd9e6752872cb9c7785504,a47ecbfd85edf33d7bcd9e6752872cb9c7785504,a47ecbfd85edf33d7bcd9e6752872cb9c7785504_298,Preliminary_2012_TELSTRA_CORPORATION_LIMITED_Earnings_Presentation_298,298,presentation,"But before I do that, let me just turn to Asia and the Network & Apps Services business.",,,,,,sentence-level event detection,2021-06-10_10:53:19,,earnings call transcript,various,Preliminary_2012_TELSTRA_CORPORATION_LIMITED_Earnings_Presentation
c61f89fc819d52ad7d47da45724ab4aef3e2809a,c61f89fc819d52ad7d47da45724ab4aef3e2809a,a47ecbfd85edf33d7bcd9e6752872cb9c7785504,a47ecbfd85edf33d7bcd9e6752872cb9c7785504,a47ecbfd85edf33d7bcd9e6752872cb9c7785504_299,Preliminary_2012_TELSTRA_CORPORATION_LIMITED_Earnings_Presentation_299,299,presentation,"We're seeing some quite significant changes there, and it's good to see the collaboration from the area that Deena is working in, which is investing in new innovative technologies, and fitting into our growth businesses.",,,,,,sentence-level event detection,2021-06-10_10:53:19,,earnings call transcript,various,Preliminary_2012_TELSTRA_CORPORATION_LIMITED_Earnings_Presentation
c61f89fc819d52ad7d47da45724ab4aef3e2809a,c61f89fc819d52ad7d47da45724ab4aef3e2809a,a47ecbfd85edf33d7bcd9e6752872cb9c7785504,a47ecbfd85edf33d7bcd9e6752872cb9c7785504,a47ecbfd85edf33d7bcd9e6752872cb9c7785504_300,Preliminary_2012_TELSTRA_CORPORATION_LIMITED_Earnings_Presentation_300,300,presentation,"Just last month, we announced the investment in a New South Wales company, very innovative company called IPscape.",,,,,,sentence-level event detection,2021-06-10_10:53:19,,earnings call transcript,various,Preliminary_2012_TELSTRA_CORPORATION_LIMITED_Earnings_Presentation
c61f89fc819d52ad7d47da45724ab4aef3e2809a,c61f89fc819d52ad7d47da45724ab4aef3e2809a,a47ecbfd85edf33d7bcd9e6752872cb9c7785504,a47ecbfd85edf33d7bcd9e6752872cb9c7785504,a47ecbfd85edf33d7bcd9e6752872cb9c7785504_301,Preliminary_2012_TELSTRA_CORPORATION_LIMITED_Earnings_Presentation_301,301,presentation,Now they provide Cloud-based call center solutions.,,,,,,sentence-level event detection,2021-06-10_10:53:19,,earnings call transcript,various,Preliminary_2012_TELSTRA_CORPORATION_LIMITED_Earnings_Presentation
c61f89fc819d52ad7d47da45724ab4aef3e2809a,c61f89fc819d52ad7d47da45724ab4aef3e2809a,a47ecbfd85edf33d7bcd9e6752872cb9c7785504,a47ecbfd85edf33d7bcd9e6752872cb9c7785504,a47ecbfd85edf33d7bcd9e6752872cb9c7785504_302,Preliminary_2012_TELSTRA_CORPORATION_LIMITED_Earnings_Presentation_302,302,presentation,"Not a lot of you picked up on it, but what is so strong about that product is it can be offered throughout Asia.",,,,,,sentence-level event detection,2021-06-10_10:53:19,,earnings call transcript,various,Preliminary_2012_TELSTRA_CORPORATION_LIMITED_Earnings_Presentation
c61f89fc819d52ad7d47da45724ab4aef3e2809a,c61f89fc819d52ad7d47da45724ab4aef3e2809a,a47ecbfd85edf33d7bcd9e6752872cb9c7785504,a47ecbfd85edf33d7bcd9e6752872cb9c7785504,a47ecbfd85edf33d7bcd9e6752872cb9c7785504_303,Preliminary_2012_TELSTRA_CORPORATION_LIMITED_Earnings_Presentation_303,303,presentation,"So Deena and Tariq are working strongly together to take that product into the international market, specifically Asia.",,,,,,sentence-level event detection,2021-06-10_10:53:19,,earnings call transcript,various,Preliminary_2012_TELSTRA_CORPORATION_LIMITED_Earnings_Presentation
c61f89fc819d52ad7d47da45724ab4aef3e2809a,c61f89fc819d52ad7d47da45724ab4aef3e2809a,a47ecbfd85edf33d7bcd9e6752872cb9c7785504,a47ecbfd85edf33d7bcd9e6752872cb9c7785504,a47ecbfd85edf33d7bcd9e6752872cb9c7785504_304,Preliminary_2012_TELSTRA_CORPORATION_LIMITED_Earnings_Presentation_304,304,presentation,"Also, Telstra Global.",,,,,,sentence-level event detection,2021-06-10_10:53:19,,earnings call transcript,various,Preliminary_2012_TELSTRA_CORPORATION_LIMITED_Earnings_Presentation
c61f89fc819d52ad7d47da45724ab4aef3e2809a,c61f89fc819d52ad7d47da45724ab4aef3e2809a,a47ecbfd85edf33d7bcd9e6752872cb9c7785504,a47ecbfd85edf33d7bcd9e6752872cb9c7785504,a47ecbfd85edf33d7bcd9e6752872cb9c7785504_305,Preliminary_2012_TELSTRA_CORPORATION_LIMITED_Earnings_Presentation_305,305,presentation,Now Telstra Global is where we provide international services and managed network services is going very well.,,,,,,sentence-level event detection,2021-06-10_10:53:19,,earnings call transcript,various,Preliminary_2012_TELSTRA_CORPORATION_LIMITED_Earnings_Presentation
c61f89fc819d52ad7d47da45724ab4aef3e2809a,c61f89fc819d52ad7d47da45724ab4aef3e2809a,a47ecbfd85edf33d7bcd9e6752872cb9c7785504,a47ecbfd85edf33d7bcd9e6752872cb9c7785504,a47ecbfd85edf33d7bcd9e6752872cb9c7785504_306,Preliminary_2012_TELSTRA_CORPORATION_LIMITED_Earnings_Presentation_306,306,presentation,"That's international data and voice, satellite across Asia Pacific, China, India, Europe and Africa.",,,,,,sentence-level event detection,2021-06-10_10:53:19,,earnings call transcript,various,Preliminary_2012_TELSTRA_CORPORATION_LIMITED_Earnings_Presentation
c61f89fc819d52ad7d47da45724ab4aef3e2809a,c61f89fc819d52ad7d47da45724ab4aef3e2809a,a47ecbfd85edf33d7bcd9e6752872cb9c7785504,a47ecbfd85edf33d7bcd9e6752872cb9c7785504,a47ecbfd85edf33d7bcd9e6752872cb9c7785504_307,Preliminary_2012_TELSTRA_CORPORATION_LIMITED_Earnings_Presentation_307,307,presentation,"You may not know it, but we have 14 carrier licenses throughout Asia, 14 carrier licenses.",,,,,,sentence-level event detection,2021-06-10_10:53:19,,earnings call transcript,various,Preliminary_2012_TELSTRA_CORPORATION_LIMITED_Earnings_Presentation
c61f89fc819d52ad7d47da45724ab4aef3e2809a,c61f89fc819d52ad7d47da45724ab4aef3e2809a,a47ecbfd85edf33d7bcd9e6752872cb9c7785504,a47ecbfd85edf33d7bcd9e6752872cb9c7785504,a47ecbfd85edf33d7bcd9e6752872cb9c7785504_308,Preliminary_2012_TELSTRA_CORPORATION_LIMITED_Earnings_Presentation_308,308,presentation,"Now, I'm not saying we're going to set up an operation in each of those countries, but it's very important in terms of managing both Australian companies going offshore, but also servicing regional customers.",,,,,,sentence-level event detection,2021-06-10_10:53:19,,earnings call transcript,various,Preliminary_2012_TELSTRA_CORPORATION_LIMITED_Earnings_Presentation
c61f89fc819d52ad7d47da45724ab4aef3e2809a,c61f89fc819d52ad7d47da45724ab4aef3e2809a,a47ecbfd85edf33d7bcd9e6752872cb9c7785504,a47ecbfd85edf33d7bcd9e6752872cb9c7785504,a47ecbfd85edf33d7bcd9e6752872cb9c7785504_309,Preliminary_2012_TELSTRA_CORPORATION_LIMITED_Earnings_Presentation_309,309,presentation,So we're very pleased with how the international portfolio is going.,,,,,,sentence-level event detection,2021-06-10_10:53:19,,earnings call transcript,various,Preliminary_2012_TELSTRA_CORPORATION_LIMITED_Earnings_Presentation
c61f89fc819d52ad7d47da45724ab4aef3e2809a,c61f89fc819d52ad7d47da45724ab4aef3e2809a,a47ecbfd85edf33d7bcd9e6752872cb9c7785504,a47ecbfd85edf33d7bcd9e6752872cb9c7785504,a47ecbfd85edf33d7bcd9e6752872cb9c7785504_310,Preliminary_2012_TELSTRA_CORPORATION_LIMITED_Earnings_Presentation_310,310,presentation,They had 7% growth in product revenue last year.,,,,,,sentence-level event detection,2021-06-10_10:53:19,,earnings call transcript,various,Preliminary_2012_TELSTRA_CORPORATION_LIMITED_Earnings_Presentation
c61f89fc819d52ad7d47da45724ab4aef3e2809a,c61f89fc819d52ad7d47da45724ab4aef3e2809a,a47ecbfd85edf33d7bcd9e6752872cb9c7785504,a47ecbfd85edf33d7bcd9e6752872cb9c7785504,a47ecbfd85edf33d7bcd9e6752872cb9c7785504_311,Preliminary_2012_TELSTRA_CORPORATION_LIMITED_Earnings_Presentation_311,311,presentation,"CSL, in local currency terms, grew 10%.",,,,,,sentence-level event detection,2021-06-10_10:53:19,,earnings call transcript,various,Preliminary_2012_TELSTRA_CORPORATION_LIMITED_Earnings_Presentation
