BATCH_ID,BATCH_UUID,DOCUMENT_UUID,FILE_UUID,TEXT_UUID,TEXT_ID,ROW_ID,SECTION,TEXT,ADJ_LABEL,ADJ_LABEL2,ADJ_LABEL3,ADJ_COMMENTS,ADJ_ANNOTATOR_ID,LABEL,LABEL2,LABEL3,COMMENTS,ANNOTATOR_ID,LABEL,LABEL2,LABEL3,COMMENTS,ANNOTATOR_ID,LABEL,LABEL2,LABEL3,COMMENTS,ANNOTATOR_ID,TASK,TIMESTAMP_DELIVERED_TO_VENDOR,TIMESTAMP_VENDOR_DELIVERY,DOCUMENT_TYPE,SECTOR,SOURCE_DOCUMENT_URI
c61f89fc819d52ad7d47da45724ab4aef3e2809a,c61f89fc819d52ad7d47da45724ab4aef3e2809a,201c8dabc231e8ca2c1533c041251944d5818986,201c8dabc231e8ca2c1533c041251944d5818986,201c8dabc231e8ca2c1533c041251944d5818986_165,Interim_2016_Centrica_PLC_Earnings_Call_165,165,presentation,"As a major contributor to this growth, particularly in the near term, we announced a substantial GBP750 million per annum efficiency program.",,,,,,project_expect,productivity_other,,,QLV,project_expect,productivity_other,,,QJM,project_expect,productivity_other,,,OUW,sentence-level event detection,2021-06-10_10:53:24,,earnings call transcript,various,Interim_2016_Centrica_PLC_Earnings_Call
c61f89fc819d52ad7d47da45724ab4aef3e2809a,c61f89fc819d52ad7d47da45724ab4aef3e2809a,201c8dabc231e8ca2c1533c041251944d5818986,201c8dabc231e8ca2c1533c041251944d5818986,201c8dabc231e8ca2c1533c041251944d5818986_166,Interim_2016_Centrica_PLC_Earnings_Call_166,166,presentation,"And finally, we said we would manage the Group's finances to underpin a progressive dividend policy with distributions in line with that underlying operating cash flow growth, and to maintain a strong balance sheet and commensurate strong investment grade credit rating.",,,,,,no_event,,,,QLV,no_event,,,,QJM,no_event,,,,OUW,sentence-level event detection,2021-06-10_10:53:24,,earnings call transcript,various,Interim_2016_Centrica_PLC_Earnings_Call
c61f89fc819d52ad7d47da45724ab4aef3e2809a,c61f89fc819d52ad7d47da45724ab4aef3e2809a,201c8dabc231e8ca2c1533c041251944d5818986,201c8dabc231e8ca2c1533c041251944d5818986,201c8dabc231e8ca2c1533c041251944d5818986_167,Interim_2016_Centrica_PLC_Earnings_Call_167,167,presentation,"In simple terms, this strategy is built around four fundamental dimensions.",,,,,,no_event,,,,QLV,no_event,,,,QJM,no_event,,,,OUW,sentence-level event detection,2021-06-10_10:53:24,,earnings call transcript,various,Interim_2016_Centrica_PLC_Earnings_Call
c61f89fc819d52ad7d47da45724ab4aef3e2809a,c61f89fc819d52ad7d47da45724ab4aef3e2809a,201c8dabc231e8ca2c1533c041251944d5818986,201c8dabc231e8ca2c1533c041251944d5818986,201c8dabc231e8ca2c1533c041251944d5818986_168,Interim_2016_Centrica_PLC_Earnings_Call_168,168,presentation,"Firstly, the recognition that the world will continue to need more energy, but yet want to use less of it per unit GDP, and produce less CO2 per unit energy.",,,,,,no_event,,,,QLV,no_event,,,,QJM,no_event,,,,OUW,sentence-level event detection,2021-06-10_10:53:24,,earnings call transcript,various,Interim_2016_Centrica_PLC_Earnings_Call
c61f89fc819d52ad7d47da45724ab4aef3e2809a,c61f89fc819d52ad7d47da45724ab4aef3e2809a,201c8dabc231e8ca2c1533c041251944d5818986,201c8dabc231e8ca2c1533c041251944d5818986,201c8dabc231e8ca2c1533c041251944d5818986_169,Interim_2016_Centrica_PLC_Earnings_Call_169,169,presentation,"Secondly, the belief that the world is in the foothills of a major revolution in energy towards a more distributed system, whether in established or emerging markets, and whether in the home or in the business.",,,,,,no_event,,,,QLV,no_event,,,,QJM,no_event,,,,OUW,sentence-level event detection,2021-06-10_10:53:24,,earnings call transcript,various,Interim_2016_Centrica_PLC_Earnings_Call
c61f89fc819d52ad7d47da45724ab4aef3e2809a,c61f89fc819d52ad7d47da45724ab4aef3e2809a,201c8dabc231e8ca2c1533c041251944d5818986,201c8dabc231e8ca2c1533c041251944d5818986,201c8dabc231e8ca2c1533c041251944d5818986_170,Interim_2016_Centrica_PLC_Earnings_Call_170,170,presentation,"Third, that the customer is at the heart of this change as they gain more choice in how they obtain energy and services, and as they demand higher standards.",,,,,,no_event,,,,QLV,no_event,,,,QJM,no_event,,,,OUW,sentence-level event detection,2021-06-10_10:53:24,,earnings call transcript,various,Interim_2016_Centrica_PLC_Earnings_Call
c61f89fc819d52ad7d47da45724ab4aef3e2809a,c61f89fc819d52ad7d47da45724ab4aef3e2809a,201c8dabc231e8ca2c1533c041251944d5818986,201c8dabc231e8ca2c1533c041251944d5818986,201c8dabc231e8ca2c1533c041251944d5818986_171,Interim_2016_Centrica_PLC_Earnings_Call_171,171,presentation,"And fourthly, the particular skills and capabilities which Centrica has today which give us the starting point from which to be a leader in such change.",,,,,,no_event,,,,QLV,no_event,,,,QJM,no_event,,,,OUW,sentence-level event detection,2021-06-10_10:53:24,,earnings call transcript,various,Interim_2016_Centrica_PLC_Earnings_Call
c61f89fc819d52ad7d47da45724ab4aef3e2809a,c61f89fc819d52ad7d47da45724ab4aef3e2809a,201c8dabc231e8ca2c1533c041251944d5818986,201c8dabc231e8ca2c1533c041251944d5818986,201c8dabc231e8ca2c1533c041251944d5818986_172,Interim_2016_Centrica_PLC_Earnings_Call_172,172,presentation,"One year on, I am more convinced than ever about these four dimensions.",,,,,,no_event,,,,QLV,no_event,,,,QJM,no_event,,,,OUW,sentence-level event detection,2021-06-10_10:53:24,,earnings call transcript,various,Interim_2016_Centrica_PLC_Earnings_Call
c61f89fc819d52ad7d47da45724ab4aef3e2809a,c61f89fc819d52ad7d47da45724ab4aef3e2809a,201c8dabc231e8ca2c1533c041251944d5818986,201c8dabc231e8ca2c1533c041251944d5818986,201c8dabc231e8ca2c1533c041251944d5818986_173,Interim_2016_Centrica_PLC_Earnings_Call_173,173,presentation,Will it be easy for Centrica to be a leader in such a transition?,,,,,,no_event,,,,QLV,no_event,,,,QJM,no_event,,,,OUW,sentence-level event detection,2021-06-10_10:53:24,,earnings call transcript,various,Interim_2016_Centrica_PLC_Earnings_Call
c61f89fc819d52ad7d47da45724ab4aef3e2809a,c61f89fc819d52ad7d47da45724ab4aef3e2809a,201c8dabc231e8ca2c1533c041251944d5818986,201c8dabc231e8ca2c1533c041251944d5818986,201c8dabc231e8ca2c1533c041251944d5818986_174,Interim_2016_Centrica_PLC_Earnings_Call_174,174,presentation,"The current environment is certainly a challenge, with low commodity prices, weak economic growth, and recently, some considerable political uncertainty.",,,,,,price_level_actual,,,,QLV,price_level_actual,,,,QJM,price_level_actual,,,,OUW,sentence-level event detection,2021-06-10_10:53:24,,earnings call transcript,various,Interim_2016_Centrica_PLC_Earnings_Call
c61f89fc819d52ad7d47da45724ab4aef3e2809a,c61f89fc819d52ad7d47da45724ab4aef3e2809a,201c8dabc231e8ca2c1533c041251944d5818986,201c8dabc231e8ca2c1533c041251944d5818986,201c8dabc231e8ca2c1533c041251944d5818986_175,Interim_2016_Centrica_PLC_Earnings_Call_175,175,presentation,"The fundamental trends suggest large market participants in energy will have to change significantly, and that will not be easy.",,,,,,no_event,,,,QLV,no_event,,,,QJM,no_event,,,,OUW,sentence-level event detection,2021-06-10_10:53:24,,earnings call transcript,various,Interim_2016_Centrica_PLC_Earnings_Call
c61f89fc819d52ad7d47da45724ab4aef3e2809a,c61f89fc819d52ad7d47da45724ab4aef3e2809a,201c8dabc231e8ca2c1533c041251944d5818986,201c8dabc231e8ca2c1533c041251944d5818986,201c8dabc231e8ca2c1533c041251944d5818986_176,Interim_2016_Centrica_PLC_Earnings_Call_176,176,presentation,"However, from where we begin, I think we have a better starting point than many.",,,,,,no_event,,,,QLV,no_event,,,,QJM,no_event,,,,OUW,sentence-level event detection,2021-06-10_10:53:24,,earnings call transcript,various,Interim_2016_Centrica_PLC_Earnings_Call
c61f89fc819d52ad7d47da45724ab4aef3e2809a,c61f89fc819d52ad7d47da45724ab4aef3e2809a,201c8dabc231e8ca2c1533c041251944d5818986,201c8dabc231e8ca2c1533c041251944d5818986,201c8dabc231e8ca2c1533c041251944d5818986_177,Interim_2016_Centrica_PLC_Earnings_Call_177,177,presentation,We have an extensive customer base and experience in serving customers at scale.,,,,,,no_event,,,,QLV,no_event,,,,QJM,no_event,,,,OUW,sentence-level event detection,2021-06-10_10:53:24,,earnings call transcript,various,Interim_2016_Centrica_PLC_Earnings_Call
c61f89fc819d52ad7d47da45724ab4aef3e2809a,c61f89fc819d52ad7d47da45724ab4aef3e2809a,201c8dabc231e8ca2c1533c041251944d5818986,201c8dabc231e8ca2c1533c041251944d5818986,201c8dabc231e8ca2c1533c041251944d5818986_178,Interim_2016_Centrica_PLC_Earnings_Call_178,178,presentation,"It will require enhanced customer-facing capabilities, and while we have a great start, we'll need to deepen in many areas, and others are seeing the world in the same way.",,,,,,no_event,,,,QLV,no_event,,,,QJM,no_event,,,,OUW,sentence-level event detection,2021-06-10_10:53:24,,earnings call transcript,various,Interim_2016_Centrica_PLC_Earnings_Call
c61f89fc819d52ad7d47da45724ab4aef3e2809a,c61f89fc819d52ad7d47da45724ab4aef3e2809a,201c8dabc231e8ca2c1533c041251944d5818986,201c8dabc231e8ca2c1533c041251944d5818986,201c8dabc231e8ca2c1533c041251944d5818986_179,Interim_2016_Centrica_PLC_Earnings_Call_179,179,presentation,"Competition will be intense and quality, efficiency, and pace of execution in everything we do will really matter if we want to stay ahead.",,,,,,productivity_other,,,,QLV,productivity_other,,,,QJM,productivity_other,,,,OUW,sentence-level event detection,2021-06-10_10:53:24,,earnings call transcript,various,Interim_2016_Centrica_PLC_Earnings_Call
c61f89fc819d52ad7d47da45724ab4aef3e2809a,c61f89fc819d52ad7d47da45724ab4aef3e2809a,201c8dabc231e8ca2c1533c041251944d5818986,201c8dabc231e8ca2c1533c041251944d5818986,201c8dabc231e8ca2c1533c041251944d5818986_180,Interim_2016_Centrica_PLC_Earnings_Call_180,180,presentation,"As part of this, we'll have to experiment and take a degree of risk, and manage it so that we pursue the right avenues and close off ones which don't work.",,,,,,no_event,,,,QLV,no_event,,,,QJM,no_event,,,,OUW,sentence-level event detection,2021-06-10_10:53:24,,earnings call transcript,various,Interim_2016_Centrica_PLC_Earnings_Call
c61f89fc819d52ad7d47da45724ab4aef3e2809a,c61f89fc819d52ad7d47da45724ab4aef3e2809a,201c8dabc231e8ca2c1533c041251944d5818986,201c8dabc231e8ca2c1533c041251944d5818986,201c8dabc231e8ca2c1533c041251944d5818986_181,Interim_2016_Centrica_PLC_Earnings_Call_181,181,presentation,"There's no doubt that there are many challenges, but a year on, I would say that for Centrica, provided we think things through, focus on quality and execute well, there are at least as many opportunities.",,,,,,no_event,,,,QLV,no_event,,,,QJM,no_event,,,,OUW,sentence-level event detection,2021-06-10_10:53:24,,earnings call transcript,various,Interim_2016_Centrica_PLC_Earnings_Call
c61f89fc819d52ad7d47da45724ab4aef3e2809a,c61f89fc819d52ad7d47da45724ab4aef3e2809a,201c8dabc231e8ca2c1533c041251944d5818986,201c8dabc231e8ca2c1533c041251944d5818986,201c8dabc231e8ca2c1533c041251944d5818986_182,Interim_2016_Centrica_PLC_Earnings_Call_182,182,presentation,So how are we doing?,,,,,,no_event,,,,QLV,no_event,,,,QJM,no_event,,,,OUW,sentence-level event detection,2021-06-10_10:53:24,,earnings call transcript,various,Interim_2016_Centrica_PLC_Earnings_Call
c61f89fc819d52ad7d47da45724ab4aef3e2809a,c61f89fc819d52ad7d47da45724ab4aef3e2809a,201c8dabc231e8ca2c1533c041251944d5818986,201c8dabc231e8ca2c1533c041251944d5818986,201c8dabc231e8ca2c1533c041251944d5818986_183,Interim_2016_Centrica_PLC_Earnings_Call_183,183,presentation,Let me start with the repositioning of our portfolio.,,,,,,no_event,,,,QLV,no_event,,,,QJM,no_event,,,,OUW,sentence-level event detection,2021-06-10_10:53:24,,earnings call transcript,various,Interim_2016_Centrica_PLC_Earnings_Call
c61f89fc819d52ad7d47da45724ab4aef3e2809a,c61f89fc819d52ad7d47da45724ab4aef3e2809a,201c8dabc231e8ca2c1533c041251944d5818986,201c8dabc231e8ca2c1533c041251944d5818986,201c8dabc231e8ca2c1533c041251944d5818986_184,Interim_2016_Centrica_PLC_Earnings_Call_184,184,presentation,"In repositioning our asset-heavy businesses, we're making good progress and have cut back our levels of investment into E&P as we look to reduce its scale and as we respond to the current environment.",,,,,,no_event,,,,QLV,no_event,,,,QJM,no_event,,,,OUW,sentence-level event detection,2021-06-10_10:53:24,,earnings call transcript,various,Interim_2016_Centrica_PLC_Earnings_Call
c61f89fc819d52ad7d47da45724ab4aef3e2809a,c61f89fc819d52ad7d47da45724ab4aef3e2809a,201c8dabc231e8ca2c1533c041251944d5818986,201c8dabc231e8ca2c1533c041251944d5818986,201c8dabc231e8ca2c1533c041251944d5818986_185,Interim_2016_Centrica_PLC_Earnings_Call_185,185,presentation,"We're targeting a broadly free cash flow neutral E&P business at low prices, and as you heard from Jeff, the business was free cash flow positive in the first half of 2016, reflecting the actions we've taken on both capital expenditure and lifting, and other cash production costs.",,,,,,no_event,,,,QLV,no_event,,,,QJM,no_event,,,,OUW,sentence-level event detection,2021-06-10_10:53:24,,earnings call transcript,various,Interim_2016_Centrica_PLC_Earnings_Call
c61f89fc819d52ad7d47da45724ab4aef3e2809a,c61f89fc819d52ad7d47da45724ab4aef3e2809a,201c8dabc231e8ca2c1533c041251944d5818986,201c8dabc231e8ca2c1533c041251944d5818986,201c8dabc231e8ca2c1533c041251944d5818986_186,Interim_2016_Centrica_PLC_Earnings_Call_186,186,presentation,We're on track to deliver our target for E&P to be free cash flow positive over 2015 and 2016 in what has been a very challenging environment.,,,,,,no_event,,,,QLV,no_event,,,,QJM,no_event,,,,OUW,sentence-level event detection,2021-06-10_10:53:24,,earnings call transcript,various,Interim_2016_Centrica_PLC_Earnings_Call
c61f89fc819d52ad7d47da45724ab4aef3e2809a,c61f89fc819d52ad7d47da45724ab4aef3e2809a,201c8dabc231e8ca2c1533c041251944d5818986,201c8dabc231e8ca2c1533c041251944d5818986,201c8dabc231e8ca2c1533c041251944d5818986_187,Interim_2016_Centrica_PLC_Earnings_Call_187,187,presentation,"As part of that, we also remain on track to achieve our full-year target for capital expenditure of around GBP500 million, the midpoint of our GBP400 million to GBP600 million targeted range, and consistent with the GBP1.5 billion reallocation of resources away from E&P.",,,,,,no_event,,,,QLV,no_event,,,,QJM,no_event,,,,OUW,sentence-level event detection,2021-06-10_10:53:24,,earnings call transcript,various,Interim_2016_Centrica_PLC_Earnings_Call
c61f89fc819d52ad7d47da45724ab4aef3e2809a,c61f89fc819d52ad7d47da45724ab4aef3e2809a,201c8dabc231e8ca2c1533c041251944d5818986,201c8dabc231e8ca2c1533c041251944d5818986,201c8dabc231e8ca2c1533c041251944d5818986_188,Interim_2016_Centrica_PLC_Earnings_Call_188,188,presentation,We now expect to deliver lifting and other cash production cost reductions of around GBP200 million in 2016 relative to a 2014 baseline.,,,,,,no_event,,,,QLV,no_event,,,,QJM,no_event,,,,OUW,sentence-level event detection,2021-06-10_10:53:24,,earnings call transcript,various,Interim_2016_Centrica_PLC_Earnings_Call
c61f89fc819d52ad7d47da45724ab4aef3e2809a,c61f89fc819d52ad7d47da45724ab4aef3e2809a,201c8dabc231e8ca2c1533c041251944d5818986,201c8dabc231e8ca2c1533c041251944d5818986,201c8dabc231e8ca2c1533c041251944d5818986_189,Interim_2016_Centrica_PLC_Earnings_Call_189,189,presentation,"We continue to consider all avenues to make E&P more robust in this environment, as we target a portfolio producing 40 million to 50 million barrels of oil equivalent per annum.",,,,,,no_event,,,,QLV,no_event,,,,QJM,no_event,,,,OUW,sentence-level event detection,2021-06-10_10:53:24,,earnings call transcript,various,Interim_2016_Centrica_PLC_Earnings_Call
c61f89fc819d52ad7d47da45724ab4aef3e2809a,c61f89fc819d52ad7d47da45724ab4aef3e2809a,201c8dabc231e8ca2c1533c041251944d5818986,201c8dabc231e8ca2c1533c041251944d5818986,201c8dabc231e8ca2c1533c041251944d5818986_190,Interim_2016_Centrica_PLC_Earnings_Call_190,190,presentation,"The low commodity price environment means it's not straightforward to divest of E&P assets, and Canadian gas prices are particularly low at the moment.",price_level_actual,,,,MDV,price_level_actual_decrease,,,,QLV,price_level_actual,,,,QJM,price_level_actual,,,,OUW,sentence-level event detection,2021-06-10_10:53:24,,earnings call transcript,various,Interim_2016_Centrica_PLC_Earnings_Call
c61f89fc819d52ad7d47da45724ab4aef3e2809a,c61f89fc819d52ad7d47da45724ab4aef3e2809a,201c8dabc231e8ca2c1533c041251944d5818986,201c8dabc231e8ca2c1533c041251944d5818986,201c8dabc231e8ca2c1533c041251944d5818986_191,Interim_2016_Centrica_PLC_Earnings_Call_191,191,presentation,"However, we have good quality assets in Canada which include infrastructure as well as production, and alongside our partners, Qatar Petroleum, we've commenced a process to sell our Canadian E&P assets.",,,,,,no_event,,,,QLV,no_event,,,,QJM,no_event,,,,OUW,sentence-level event detection,2021-06-10_10:53:24,,earnings call transcript,various,Interim_2016_Centrica_PLC_Earnings_Call
c61f89fc819d52ad7d47da45724ab4aef3e2809a,c61f89fc819d52ad7d47da45724ab4aef3e2809a,201c8dabc231e8ca2c1533c041251944d5818986,201c8dabc231e8ca2c1533c041251944d5818986,201c8dabc231e8ca2c1533c041251944d5818986_192,Interim_2016_Centrica_PLC_Earnings_Call_192,192,presentation,We're targeting completing our exit from the region by the end of 2017.,,,,,,no_event,,,,QLV,no_event,,,,QJM,no_event,,,,OUW,sentence-level event detection,2021-06-10_10:53:24,,earnings call transcript,various,Interim_2016_Centrica_PLC_Earnings_Call
c61f89fc819d52ad7d47da45724ab4aef3e2809a,c61f89fc819d52ad7d47da45724ab4aef3e2809a,201c8dabc231e8ca2c1533c041251944d5818986,201c8dabc231e8ca2c1533c041251944d5818986,201c8dabc231e8ca2c1533c041251944d5818986_193,Interim_2016_Centrica_PLC_Earnings_Call_193,193,presentation,We also continue to make progress in rationalizing our central power generation business.,,,,,,no_event,,,,QLV,no_event,,,,QJM,no_event,,,,OUW,sentence-level event detection,2021-06-10_10:53:24,,earnings call transcript,various,Interim_2016_Centrica_PLC_Earnings_Call
c61f89fc819d52ad7d47da45724ab4aef3e2809a,c61f89fc819d52ad7d47da45724ab4aef3e2809a,201c8dabc231e8ca2c1533c041251944d5818986,201c8dabc231e8ca2c1533c041251944d5818986,201c8dabc231e8ca2c1533c041251944d5818986_194,Interim_2016_Centrica_PLC_Earnings_Call_194,194,presentation,We've now closed the Killingholme gas-fired power station and will assess our options for the rest of our fleet in light of the capacity auction reforms.,,,,,,capacity_other,,,,QLV,capacity_other,,,,QJM,capacity_other,,,,OUW,sentence-level event detection,2021-06-10_10:53:24,,earnings call transcript,various,Interim_2016_Centrica_PLC_Earnings_Call
c61f89fc819d52ad7d47da45724ab4aef3e2809a,c61f89fc819d52ad7d47da45724ab4aef3e2809a,201c8dabc231e8ca2c1533c041251944d5818986,201c8dabc231e8ca2c1533c041251944d5818986,201c8dabc231e8ca2c1533c041251944d5818986_195,Interim_2016_Centrica_PLC_Earnings_Call_195,195,presentation,"In wind generation, we concluded the disposal of the GLID joint venture in the first half, and expect to dispose of our remaining wind asset, Lincs, by the end of 2017.",,,,,,no_event,,,,QLV,no_event,,,,QJM,no_event,,,,OUW,sentence-level event detection,2021-06-10_10:53:24,,earnings call transcript,various,Interim_2016_Centrica_PLC_Earnings_Call
c61f89fc819d52ad7d47da45724ab4aef3e2809a,c61f89fc819d52ad7d47da45724ab4aef3e2809a,201c8dabc231e8ca2c1533c041251944d5818986,201c8dabc231e8ca2c1533c041251944d5818986,201c8dabc231e8ca2c1533c041251944d5818986_196,Interim_2016_Centrica_PLC_Earnings_Call_196,196,presentation,How are we doing in shifting our growth focus towards the customer-facing businesses?,,,,,,no_event,,,,QLV,no_event,,,,QJM,no_event,,,,OUW,sentence-level event detection,2021-06-10_10:53:24,,earnings call transcript,various,Interim_2016_Centrica_PLC_Earnings_Call
c61f89fc819d52ad7d47da45724ab4aef3e2809a,c61f89fc819d52ad7d47da45724ab4aef3e2809a,201c8dabc231e8ca2c1533c041251944d5818986,201c8dabc231e8ca2c1533c041251944d5818986,201c8dabc231e8ca2c1533c041251944d5818986_197,Interim_2016_Centrica_PLC_Earnings_Call_197,197,presentation,"As we said last July, our main focus areas for long-term growth are energy supply, services, distributed energy & power, the connected home, and energy marketing & trading.",,,,,,production_expect,,,,QLV,production_expect,,,,QJM,production_expect,,,,OUW,sentence-level event detection,2021-06-10_10:53:24,,earnings call transcript,various,Interim_2016_Centrica_PLC_Earnings_Call
c61f89fc819d52ad7d47da45724ab4aef3e2809a,c61f89fc819d52ad7d47da45724ab4aef3e2809a,201c8dabc231e8ca2c1533c041251944d5818986,201c8dabc231e8ca2c1533c041251944d5818986,201c8dabc231e8ca2c1533c041251944d5818986_198,Interim_2016_Centrica_PLC_Earnings_Call_198,198,presentation,"In energy supply & services, we are repositioning the organization and our capability to underpin growth.",,,,,,no_event,,,,QLV,no_event,,,,QJM,no_event,,,,OUW,sentence-level event detection,2021-06-10_10:53:24,,earnings call transcript,various,Interim_2016_Centrica_PLC_Earnings_Call
c61f89fc819d52ad7d47da45724ab4aef3e2809a,c61f89fc819d52ad7d47da45724ab4aef3e2809a,201c8dabc231e8ca2c1533c041251944d5818986,201c8dabc231e8ca2c1533c041251944d5818986,201c8dabc231e8ca2c1533c041251944d5818986_199,Interim_2016_Centrica_PLC_Earnings_Call_199,199,presentation,"We're also very focused on delivering higher levels of customer service, improved cost efficiency, and offer innovation, which we see as key to our success in establishing the platform for growth.",,,,,,productivity_actual_increase,,,,QLV,productivity_actual_increase,,,,QJM,productivity_actual_increase,,,,OUW,sentence-level event detection,2021-06-10_10:53:24,,earnings call transcript,various,Interim_2016_Centrica_PLC_Earnings_Call
c61f89fc819d52ad7d47da45724ab4aef3e2809a,c61f89fc819d52ad7d47da45724ab4aef3e2809a,201c8dabc231e8ca2c1533c041251944d5818986,201c8dabc231e8ca2c1533c041251944d5818986,201c8dabc231e8ca2c1533c041251944d5818986_200,Interim_2016_Centrica_PLC_Earnings_Call_200,200,presentation,And we've made progress in all of these areas in the first half of 2016.,,,,,,no_event,,,,QLV,no_event,,,,QJM,no_event,,,,OUW,sentence-level event detection,2021-06-10_10:53:24,,earnings call transcript,various,Interim_2016_Centrica_PLC_Earnings_Call
c61f89fc819d52ad7d47da45724ab4aef3e2809a,c61f89fc819d52ad7d47da45724ab4aef3e2809a,201c8dabc231e8ca2c1533c041251944d5818986,201c8dabc231e8ca2c1533c041251944d5818986,201c8dabc231e8ca2c1533c041251944d5818986_201,Interim_2016_Centrica_PLC_Earnings_Call_201,201,presentation,"In developing new businesses in B2B, we've also added significant additional capabilities in distributed energy & power and in energy marketing & trading over the past year.",,,,,,no_event,,,,QLV,no_event,,,,QJM,no_event,,,,OUW,sentence-level event detection,2021-06-10_10:53:24,,earnings call transcript,various,Interim_2016_Centrica_PLC_Earnings_Call
c61f89fc819d52ad7d47da45724ab4aef3e2809a,c61f89fc819d52ad7d47da45724ab4aef3e2809a,201c8dabc231e8ca2c1533c041251944d5818986,201c8dabc231e8ca2c1533c041251944d5818986,201c8dabc231e8ca2c1533c041251944d5818986_202,Interim_2016_Centrica_PLC_Earnings_Call_202,202,presentation,"The acquisitions of Panoramic Power, ENER-G Cogen and Neas Energy, all add additional complementary capabilities and customers, which will allow us to accelerate our growth strategy.",,,,,,no_event,,,,QLV,no_event,,,,QJM,no_event,,,,OUW,sentence-level event detection,2021-06-10_10:53:24,,earnings call transcript,various,Interim_2016_Centrica_PLC_Earnings_Call
c61f89fc819d52ad7d47da45724ab4aef3e2809a,c61f89fc819d52ad7d47da45724ab4aef3e2809a,201c8dabc231e8ca2c1533c041251944d5818986,201c8dabc231e8ca2c1533c041251944d5818986,201c8dabc231e8ca2c1533c041251944d5818986_203,Interim_2016_Centrica_PLC_Earnings_Call_203,203,presentation,"And in connected home, we've seen sustained growth in the number of hubs installed, launched five new products in the first half of 2016 alone, and expanded our horizons beyond the UK to other markets as we build an international business.",,,,,,new_product_launch_actual,,,,QLV,new_product_launch_actual,,,,QJM,new_product_launch_actual,,,,OUW,sentence-level event detection,2021-06-10_10:53:24,,earnings call transcript,various,Interim_2016_Centrica_PLC_Earnings_Call
c61f89fc819d52ad7d47da45724ab4aef3e2809a,c61f89fc819d52ad7d47da45724ab4aef3e2809a,201c8dabc231e8ca2c1533c041251944d5818986,201c8dabc231e8ca2c1533c041251944d5818986,201c8dabc231e8ca2c1533c041251944d5818986_204,Interim_2016_Centrica_PLC_Earnings_Call_204,204,presentation,Let me expand on these areas briefly.,,,,,,no_event,,,,QLV,no_event,,,,QJM,no_event,,,,OUW,sentence-level event detection,2021-06-10_10:53:24,,earnings call transcript,various,Interim_2016_Centrica_PLC_Earnings_Call
c61f89fc819d52ad7d47da45724ab4aef3e2809a,c61f89fc819d52ad7d47da45724ab4aef3e2809a,201c8dabc231e8ca2c1533c041251944d5818986,201c8dabc231e8ca2c1533c041251944d5818986,201c8dabc231e8ca2c1533c041251944d5818986_205,Interim_2016_Centrica_PLC_Earnings_Call_205,205,presentation,"In our established channels of energy supply & services, in both B2C and B2B channels, we're seeing encouraging results.",,,,,,no_event,,,,QLV,no_event,,,,QJM,no_event,,,,OUW,sentence-level event detection,2021-06-10_10:53:24,,earnings call transcript,various,Interim_2016_Centrica_PLC_Earnings_Call
c61f89fc819d52ad7d47da45724ab4aef3e2809a,c61f89fc819d52ad7d47da45724ab4aef3e2809a,201c8dabc231e8ca2c1533c041251944d5818986,201c8dabc231e8ca2c1533c041251944d5818986,201c8dabc231e8ca2c1533c041251944d5818986_206,Interim_2016_Centrica_PLC_Earnings_Call_206,206,presentation,"In our home business units, as we invest more in customer service, we are seeing significantly reduced complaints.",,,,,,no_event,,,,QLV,no_event,,,,QJM,no_event,,,,OUW,sentence-level event detection,2021-06-10_10:53:24,,earnings call transcript,various,Interim_2016_Centrica_PLC_Earnings_Call
