BATCH_ID,BATCH_UUID,DOCUMENT_UUID,FILE_UUID,TEXT_UUID,TEXT_ID,ROW_ID,SECTION,TEXT,LABEL,LABEL2,LABEL3,COMMENTS,ANNOTATOR_ID,TASK,TIMESTAMP_DELIVERED_TO_VENDOR,TIMESTAMP_VENDOR_DELIVERY,DOCUMENT_TYPE,SECTOR,SOURCE_DOCUMENT_URI
c61f89fc819d52ad7d47da45724ab4aef3e2809a,c61f89fc819d52ad7d47da45724ab4aef3e2809a,32feed72947559e919bcfc4ce40fc2e8174d0164,32feed72947559e919bcfc4ce40fc2e8174d0164,32feed72947559e919bcfc4ce40fc2e8174d0164_0,Q3_2020_Valero_Energy_Corp_Earnings_Call_0,0,operator,"Greetings, and welcome to the Valero Energy Third Quarter Earnings Conference Call.",,,,,,sentence-level event detection,2021-06-10_10:53:20,,earnings call transcript,various,Q3_2020_Valero_Energy_Corp_Earnings_Call
c61f89fc819d52ad7d47da45724ab4aef3e2809a,c61f89fc819d52ad7d47da45724ab4aef3e2809a,32feed72947559e919bcfc4ce40fc2e8174d0164,32feed72947559e919bcfc4ce40fc2e8174d0164,32feed72947559e919bcfc4ce40fc2e8174d0164_1,Q3_2020_Valero_Energy_Corp_Earnings_Call_1,1,operator,"(Operator Instructions) As a reminder, this conference is being recorded.",,,,,,sentence-level event detection,2021-06-10_10:53:20,,earnings call transcript,various,Q3_2020_Valero_Energy_Corp_Earnings_Call
c61f89fc819d52ad7d47da45724ab4aef3e2809a,c61f89fc819d52ad7d47da45724ab4aef3e2809a,32feed72947559e919bcfc4ce40fc2e8174d0164,32feed72947559e919bcfc4ce40fc2e8174d0164,32feed72947559e919bcfc4ce40fc2e8174d0164_2,Q3_2020_Valero_Energy_Corp_Earnings_Call_2,2,operator,"It is now my pleasure to introduce your host, Homer Bhullar, Vice President of Investor Relations.",,,,,,sentence-level event detection,2021-06-10_10:53:20,,earnings call transcript,various,Q3_2020_Valero_Energy_Corp_Earnings_Call
c61f89fc819d52ad7d47da45724ab4aef3e2809a,c61f89fc819d52ad7d47da45724ab4aef3e2809a,32feed72947559e919bcfc4ce40fc2e8174d0164,32feed72947559e919bcfc4ce40fc2e8174d0164,32feed72947559e919bcfc4ce40fc2e8174d0164_3,Q3_2020_Valero_Energy_Corp_Earnings_Call_3,3,operator,"Thank you, sir.",,,,,,sentence-level event detection,2021-06-10_10:53:20,,earnings call transcript,various,Q3_2020_Valero_Energy_Corp_Earnings_Call
c61f89fc819d52ad7d47da45724ab4aef3e2809a,c61f89fc819d52ad7d47da45724ab4aef3e2809a,32feed72947559e919bcfc4ce40fc2e8174d0164,32feed72947559e919bcfc4ce40fc2e8174d0164,32feed72947559e919bcfc4ce40fc2e8174d0164_4,Q3_2020_Valero_Energy_Corp_Earnings_Call_4,4,operator,You may begin.,,,,,,sentence-level event detection,2021-06-10_10:53:20,,earnings call transcript,various,Q3_2020_Valero_Energy_Corp_Earnings_Call
c61f89fc819d52ad7d47da45724ab4aef3e2809a,c61f89fc819d52ad7d47da45724ab4aef3e2809a,32feed72947559e919bcfc4ce40fc2e8174d0164,32feed72947559e919bcfc4ce40fc2e8174d0164,32feed72947559e919bcfc4ce40fc2e8174d0164_5,Q3_2020_Valero_Energy_Corp_Earnings_Call_5,5,presentation,"Good morning, everyone, and welcome to Valero Energy Corporation's Third Quarter 2020 Earnings Conference Call.",,,,,,sentence-level event detection,2021-06-10_10:53:20,,earnings call transcript,various,Q3_2020_Valero_Energy_Corp_Earnings_Call
c61f89fc819d52ad7d47da45724ab4aef3e2809a,c61f89fc819d52ad7d47da45724ab4aef3e2809a,32feed72947559e919bcfc4ce40fc2e8174d0164,32feed72947559e919bcfc4ce40fc2e8174d0164,32feed72947559e919bcfc4ce40fc2e8174d0164_6,Q3_2020_Valero_Energy_Corp_Earnings_Call_6,6,presentation,"With me today are Joe Gorder, our Chairman and CEO; Lane Riggs, our President and COO; Jason Fraser, our Executive Vice President and CFO; Gary Simmons, our Executive Vice President and Chief Commercial Officer; and several other members of Valero's senior management team.",,,,,,sentence-level event detection,2021-06-10_10:53:20,,earnings call transcript,various,Q3_2020_Valero_Energy_Corp_Earnings_Call
c61f89fc819d52ad7d47da45724ab4aef3e2809a,c61f89fc819d52ad7d47da45724ab4aef3e2809a,32feed72947559e919bcfc4ce40fc2e8174d0164,32feed72947559e919bcfc4ce40fc2e8174d0164,32feed72947559e919bcfc4ce40fc2e8174d0164_7,Q3_2020_Valero_Energy_Corp_Earnings_Call_7,7,presentation,"If you have not received the earnings release and would like a copy, you can find one on our website at investorvalero.com.",,,,,,sentence-level event detection,2021-06-10_10:53:20,,earnings call transcript,various,Q3_2020_Valero_Energy_Corp_Earnings_Call
c61f89fc819d52ad7d47da45724ab4aef3e2809a,c61f89fc819d52ad7d47da45724ab4aef3e2809a,32feed72947559e919bcfc4ce40fc2e8174d0164,32feed72947559e919bcfc4ce40fc2e8174d0164,32feed72947559e919bcfc4ce40fc2e8174d0164_8,Q3_2020_Valero_Energy_Corp_Earnings_Call_8,8,presentation,Also attached to the earnings release are tables that provide additional financial information on our business segments.,,,,,,sentence-level event detection,2021-06-10_10:53:20,,earnings call transcript,various,Q3_2020_Valero_Energy_Corp_Earnings_Call
c61f89fc819d52ad7d47da45724ab4aef3e2809a,c61f89fc819d52ad7d47da45724ab4aef3e2809a,32feed72947559e919bcfc4ce40fc2e8174d0164,32feed72947559e919bcfc4ce40fc2e8174d0164,32feed72947559e919bcfc4ce40fc2e8174d0164_9,Q3_2020_Valero_Energy_Corp_Earnings_Call_9,9,presentation,"If you have any questions after reviewing these tables, please feel free to contact our investor relations team after the call.",,,,,,sentence-level event detection,2021-06-10_10:53:20,,earnings call transcript,various,Q3_2020_Valero_Energy_Corp_Earnings_Call
c61f89fc819d52ad7d47da45724ab4aef3e2809a,c61f89fc819d52ad7d47da45724ab4aef3e2809a,32feed72947559e919bcfc4ce40fc2e8174d0164,32feed72947559e919bcfc4ce40fc2e8174d0164,32feed72947559e919bcfc4ce40fc2e8174d0164_10,Q3_2020_Valero_Energy_Corp_Earnings_Call_10,10,presentation,I would now like to direct your attention to the forward-looking statement disclaimer contained in the press release.,,,,,,sentence-level event detection,2021-06-10_10:53:20,,earnings call transcript,various,Q3_2020_Valero_Energy_Corp_Earnings_Call
c61f89fc819d52ad7d47da45724ab4aef3e2809a,c61f89fc819d52ad7d47da45724ab4aef3e2809a,32feed72947559e919bcfc4ce40fc2e8174d0164,32feed72947559e919bcfc4ce40fc2e8174d0164,32feed72947559e919bcfc4ce40fc2e8174d0164_12,Q3_2020_Valero_Energy_Corp_Earnings_Call_12,12,presentation,"There are many factors that could cause actual results to differ from our expectations, including those we've described in our filings with the SEC.",,,,,,sentence-level event detection,2021-06-10_10:53:20,,earnings call transcript,various,Q3_2020_Valero_Energy_Corp_Earnings_Call
c61f89fc819d52ad7d47da45724ab4aef3e2809a,c61f89fc819d52ad7d47da45724ab4aef3e2809a,32feed72947559e919bcfc4ce40fc2e8174d0164,32feed72947559e919bcfc4ce40fc2e8174d0164,32feed72947559e919bcfc4ce40fc2e8174d0164_13,Q3_2020_Valero_Energy_Corp_Earnings_Call_13,13,presentation,Now I'll turn the call over to Joe for opening remarks.,,,,,,sentence-level event detection,2021-06-10_10:53:20,,earnings call transcript,various,Q3_2020_Valero_Energy_Corp_Earnings_Call
c61f89fc819d52ad7d47da45724ab4aef3e2809a,c61f89fc819d52ad7d47da45724ab4aef3e2809a,32feed72947559e919bcfc4ce40fc2e8174d0164,32feed72947559e919bcfc4ce40fc2e8174d0164,32feed72947559e919bcfc4ce40fc2e8174d0164_14,Q3_2020_Valero_Energy_Corp_Earnings_Call_14,14,presentation,"Thanks, Homer, and good morning, everyone.",,,,,,sentence-level event detection,2021-06-10_10:53:20,,earnings call transcript,various,Q3_2020_Valero_Energy_Corp_Earnings_Call
c61f89fc819d52ad7d47da45724ab4aef3e2809a,c61f89fc819d52ad7d47da45724ab4aef3e2809a,32feed72947559e919bcfc4ce40fc2e8174d0164,32feed72947559e919bcfc4ce40fc2e8174d0164,32feed72947559e919bcfc4ce40fc2e8174d0164_15,Q3_2020_Valero_Energy_Corp_Earnings_Call_15,15,presentation,"The third quarter was another challenging period, in which refining margins continue to be pressured by pandemic-imposed restrictions on global economies.",,,,,,sentence-level event detection,2021-06-10_10:53:20,,earnings call transcript,various,Q3_2020_Valero_Energy_Corp_Earnings_Call
c61f89fc819d52ad7d47da45724ab4aef3e2809a,c61f89fc819d52ad7d47da45724ab4aef3e2809a,32feed72947559e919bcfc4ce40fc2e8174d0164,32feed72947559e919bcfc4ce40fc2e8174d0164,32feed72947559e919bcfc4ce40fc2e8174d0164_16,Q3_2020_Valero_Energy_Corp_Earnings_Call_16,16,presentation,"These restrictions have limited individual movement and in-person activities across the globe, resulting in lower demand for finished refinery products.",,,,,,sentence-level event detection,2021-06-10_10:53:20,,earnings call transcript,various,Q3_2020_Valero_Energy_Corp_Earnings_Call
c61f89fc819d52ad7d47da45724ab4aef3e2809a,c61f89fc819d52ad7d47da45724ab4aef3e2809a,32feed72947559e919bcfc4ce40fc2e8174d0164,32feed72947559e919bcfc4ce40fc2e8174d0164,32feed72947559e919bcfc4ce40fc2e8174d0164_17,Q3_2020_Valero_Energy_Corp_Earnings_Call_17,17,presentation,"This, in turn, has created less incentive to produce crude oil and has led to narrower crude oil discounts compared to last year.",,,,,,sentence-level event detection,2021-06-10_10:53:20,,earnings call transcript,various,Q3_2020_Valero_Energy_Corp_Earnings_Call
c61f89fc819d52ad7d47da45724ab4aef3e2809a,c61f89fc819d52ad7d47da45724ab4aef3e2809a,32feed72947559e919bcfc4ce40fc2e8174d0164,32feed72947559e919bcfc4ce40fc2e8174d0164,32feed72947559e919bcfc4ce40fc2e8174d0164_18,Q3_2020_Valero_Energy_Corp_Earnings_Call_18,18,presentation,"Despite this challenging environment, there were a number of positive developments from the previous quarter as product demand increased with incremental easing of restrictions on businesses and the reopening of some schools.",,,,,,sentence-level event detection,2021-06-10_10:53:20,,earnings call transcript,various,Q3_2020_Valero_Energy_Corp_Earnings_Call
c61f89fc819d52ad7d47da45724ab4aef3e2809a,c61f89fc819d52ad7d47da45724ab4aef3e2809a,32feed72947559e919bcfc4ce40fc2e8174d0164,32feed72947559e919bcfc4ce40fc2e8174d0164,32feed72947559e919bcfc4ce40fc2e8174d0164_19,Q3_2020_Valero_Energy_Corp_Earnings_Call_19,19,presentation,"Relative to the second quarter, DOE statistics show that gasoline, diesel and jet demand improved by 25%, 7% and 57%, respectively, which is in line with the increase in demand that we experienced across our system.",,,,,,sentence-level event detection,2021-06-10_10:53:20,,earnings call transcript,various,Q3_2020_Valero_Energy_Corp_Earnings_Call
c61f89fc819d52ad7d47da45724ab4aef3e2809a,c61f89fc819d52ad7d47da45724ab4aef3e2809a,32feed72947559e919bcfc4ce40fc2e8174d0164,32feed72947559e919bcfc4ce40fc2e8174d0164,32feed72947559e919bcfc4ce40fc2e8174d0164_20,Q3_2020_Valero_Energy_Corp_Earnings_Call_20,20,presentation,"Our wholesale volumes remained steady, moving over 50% of our total light products production.",,,,,,sentence-level event detection,2021-06-10_10:53:20,,earnings call transcript,various,Q3_2020_Valero_Energy_Corp_Earnings_Call
c61f89fc819d52ad7d47da45724ab4aef3e2809a,c61f89fc819d52ad7d47da45724ab4aef3e2809a,32feed72947559e919bcfc4ce40fc2e8174d0164,32feed72947559e919bcfc4ce40fc2e8174d0164,32feed72947559e919bcfc4ce40fc2e8174d0164_21,Q3_2020_Valero_Energy_Corp_Earnings_Call_21,21,presentation,Our gasoline and distillate exports to Latin America and Europe were also robust in the third quarter.,,,,,,sentence-level event detection,2021-06-10_10:53:20,,earnings call transcript,various,Q3_2020_Valero_Energy_Corp_Earnings_Call
c61f89fc819d52ad7d47da45724ab4aef3e2809a,c61f89fc819d52ad7d47da45724ab4aef3e2809a,32feed72947559e919bcfc4ce40fc2e8174d0164,32feed72947559e919bcfc4ce40fc2e8174d0164,32feed72947559e919bcfc4ce40fc2e8174d0164_22,Q3_2020_Valero_Energy_Corp_Earnings_Call_22,22,presentation,"We exported 316,000 barrels per day in the third quarter, which is significantly higher than the 170,000 barrels per day we exported in the second quarter.",,,,,,sentence-level event detection,2021-06-10_10:53:20,,earnings call transcript,various,Q3_2020_Valero_Energy_Corp_Earnings_Call
c61f89fc819d52ad7d47da45724ab4aef3e2809a,c61f89fc819d52ad7d47da45724ab4aef3e2809a,32feed72947559e919bcfc4ce40fc2e8174d0164,32feed72947559e919bcfc4ce40fc2e8174d0164,32feed72947559e919bcfc4ce40fc2e8174d0164_23,Q3_2020_Valero_Energy_Corp_Earnings_Call_23,23,presentation,"We also saw a steady increase in our wholesale volumes into Mexico, where we have been proactively expanding our logistics network for the last several years.",,,,,,sentence-level event detection,2021-06-10_10:53:20,,earnings call transcript,various,Q3_2020_Valero_Energy_Corp_Earnings_Call
c61f89fc819d52ad7d47da45724ab4aef3e2809a,c61f89fc819d52ad7d47da45724ab4aef3e2809a,32feed72947559e919bcfc4ce40fc2e8174d0164,32feed72947559e919bcfc4ce40fc2e8174d0164,32feed72947559e919bcfc4ce40fc2e8174d0164_24,Q3_2020_Valero_Energy_Corp_Earnings_Call_24,24,presentation,"In fact, Valero is now one of the largest private fuel importers into Mexico.",,,,,,sentence-level event detection,2021-06-10_10:53:20,,earnings call transcript,various,Q3_2020_Valero_Energy_Corp_Earnings_Call
c61f89fc819d52ad7d47da45724ab4aef3e2809a,c61f89fc819d52ad7d47da45724ab4aef3e2809a,32feed72947559e919bcfc4ce40fc2e8174d0164,32feed72947559e919bcfc4ce40fc2e8174d0164,32feed72947559e919bcfc4ce40fc2e8174d0164_25,Q3_2020_Valero_Energy_Corp_Earnings_Call_25,25,presentation,"With the incremental easing of restrictions and higher product demand, our refinery utilization increased from 74% in the second quarter to 80% in the third quarter, and we increased our ethanol plant production as well from 49% to 81% of capacity.",,,,,,sentence-level event detection,2021-06-10_10:53:20,,earnings call transcript,various,Q3_2020_Valero_Energy_Corp_Earnings_Call
c61f89fc819d52ad7d47da45724ab4aef3e2809a,c61f89fc819d52ad7d47da45724ab4aef3e2809a,32feed72947559e919bcfc4ce40fc2e8174d0164,32feed72947559e919bcfc4ce40fc2e8174d0164,32feed72947559e919bcfc4ce40fc2e8174d0164_26,Q3_2020_Valero_Energy_Corp_Earnings_Call_26,26,presentation,"Our low-carbon renewable diesel business remains resilient with another quarter of solid performance, realizing a margin of $2.72 per gallon and setting a record for sales volumes.",,,,,,sentence-level event detection,2021-06-10_10:53:20,,earnings call transcript,various,Q3_2020_Valero_Energy_Corp_Earnings_Call
c61f89fc819d52ad7d47da45724ab4aef3e2809a,c61f89fc819d52ad7d47da45724ab4aef3e2809a,32feed72947559e919bcfc4ce40fc2e8174d0164,32feed72947559e919bcfc4ce40fc2e8174d0164,32feed72947559e919bcfc4ce40fc2e8174d0164_27,Q3_2020_Valero_Energy_Corp_Earnings_Call_27,27,presentation,"In addition, we remain well capitalized.",,,,,,sentence-level event detection,2021-06-10_10:53:20,,earnings call transcript,various,Q3_2020_Valero_Energy_Corp_Earnings_Call
c61f89fc819d52ad7d47da45724ab4aef3e2809a,c61f89fc819d52ad7d47da45724ab4aef3e2809a,32feed72947559e919bcfc4ce40fc2e8174d0164,32feed72947559e919bcfc4ce40fc2e8174d0164,32feed72947559e919bcfc4ce40fc2e8174d0164_28,Q3_2020_Valero_Energy_Corp_Earnings_Call_28,28,presentation,We ended the quarter with over $4 billion of cash and almost $10 billion of total available liquidity.,,,,,,sentence-level event detection,2021-06-10_10:53:20,,earnings call transcript,various,Q3_2020_Valero_Energy_Corp_Earnings_Call
c61f89fc819d52ad7d47da45724ab4aef3e2809a,c61f89fc819d52ad7d47da45724ab4aef3e2809a,32feed72947559e919bcfc4ce40fc2e8174d0164,32feed72947559e919bcfc4ce40fc2e8174d0164,32feed72947559e919bcfc4ce40fc2e8174d0164_29,Q3_2020_Valero_Energy_Corp_Earnings_Call_29,29,presentation,"While we expect margins to improve as economies continue to reopen and product inventories come down to normal levels, we opportunistically raised another $2.5 billion of debt at very attractive rates to ensure that we're able to keep our high-return projects on track and to honor our commitment to shareholders, even if the current low-margin environment persists for longer than currently anticipated.",,,,,,sentence-level event detection,2021-06-10_10:53:20,,earnings call transcript,various,Q3_2020_Valero_Energy_Corp_Earnings_Call
c61f89fc819d52ad7d47da45724ab4aef3e2809a,c61f89fc819d52ad7d47da45724ab4aef3e2809a,32feed72947559e919bcfc4ce40fc2e8174d0164,32feed72947559e919bcfc4ce40fc2e8174d0164,32feed72947559e919bcfc4ce40fc2e8174d0164_30,Q3_2020_Valero_Energy_Corp_Earnings_Call_30,30,presentation,Turning to capital investments.,,,,,,sentence-level event detection,2021-06-10_10:53:20,,earnings call transcript,various,Q3_2020_Valero_Energy_Corp_Earnings_Call
c61f89fc819d52ad7d47da45724ab4aef3e2809a,c61f89fc819d52ad7d47da45724ab4aef3e2809a,32feed72947559e919bcfc4ce40fc2e8174d0164,32feed72947559e919bcfc4ce40fc2e8174d0164,32feed72947559e919bcfc4ce40fc2e8174d0164_31,Q3_2020_Valero_Energy_Corp_Earnings_Call_31,31,presentation,We continue to execute on announced projects that are expected to drive long-term earnings growth.,,,,,,sentence-level event detection,2021-06-10_10:53:20,,earnings call transcript,various,Q3_2020_Valero_Energy_Corp_Earnings_Call
c61f89fc819d52ad7d47da45724ab4aef3e2809a,c61f89fc819d52ad7d47da45724ab4aef3e2809a,32feed72947559e919bcfc4ce40fc2e8174d0164,32feed72947559e919bcfc4ce40fc2e8174d0164,32feed72947559e919bcfc4ce40fc2e8174d0164_32,Q3_2020_Valero_Energy_Corp_Earnings_Call_32,32,presentation,The St.,,,,,,sentence-level event detection,2021-06-10_10:53:20,,earnings call transcript,various,Q3_2020_Valero_Energy_Corp_Earnings_Call
c61f89fc819d52ad7d47da45724ab4aef3e2809a,c61f89fc819d52ad7d47da45724ab4aef3e2809a,32feed72947559e919bcfc4ce40fc2e8174d0164,32feed72947559e919bcfc4ce40fc2e8174d0164,32feed72947559e919bcfc4ce40fc2e8174d0164_33,Q3_2020_Valero_Energy_Corp_Earnings_Call_33,33,presentation,"Charles Alkylation Unit, which is designed to convert low-value feedstocks into a premium alkylate product, remains on track to be completed in the fourth quarter.",,,,,,sentence-level event detection,2021-06-10_10:53:20,,earnings call transcript,various,Q3_2020_Valero_Energy_Corp_Earnings_Call
c61f89fc819d52ad7d47da45724ab4aef3e2809a,c61f89fc819d52ad7d47da45724ab4aef3e2809a,32feed72947559e919bcfc4ce40fc2e8174d0164,32feed72947559e919bcfc4ce40fc2e8174d0164,32feed72947559e919bcfc4ce40fc2e8174d0164_34,Q3_2020_Valero_Energy_Corp_Earnings_Call_34,34,presentation,"The Diamond Pipeline expansion and the Pembroke Cogen project are expected to be completed in 2021, and the Port Arthur Coker project is expected to be completed in 2023.",,,,,,sentence-level event detection,2021-06-10_10:53:20,,earnings call transcript,various,Q3_2020_Valero_Energy_Corp_Earnings_Call
c61f89fc819d52ad7d47da45724ab4aef3e2809a,c61f89fc819d52ad7d47da45724ab4aef3e2809a,32feed72947559e919bcfc4ce40fc2e8174d0164,32feed72947559e919bcfc4ce40fc2e8174d0164,32feed72947559e919bcfc4ce40fc2e8174d0164_35,Q3_2020_Valero_Energy_Corp_Earnings_Call_35,35,presentation,"We're also evaluating a number of other low-carbon growth projects that are in the development phase of our gated process, and we continue to strengthen our long-term competitive advantage with investments in our renewable diesel business.",,,,,,sentence-level event detection,2021-06-10_10:53:20,,earnings call transcript,various,Q3_2020_Valero_Energy_Corp_Earnings_Call
c61f89fc819d52ad7d47da45724ab4aef3e2809a,c61f89fc819d52ad7d47da45724ab4aef3e2809a,32feed72947559e919bcfc4ce40fc2e8174d0164,32feed72947559e919bcfc4ce40fc2e8174d0164,32feed72947559e919bcfc4ce40fc2e8174d0164_36,Q3_2020_Valero_Energy_Corp_Earnings_Call_36,36,presentation,The Diamond Green Diesel expansion project at St.,,,,,,sentence-level event detection,2021-06-10_10:53:20,,earnings call transcript,various,Q3_2020_Valero_Energy_Corp_Earnings_Call
c61f89fc819d52ad7d47da45724ab4aef3e2809a,c61f89fc819d52ad7d47da45724ab4aef3e2809a,32feed72947559e919bcfc4ce40fc2e8174d0164,32feed72947559e919bcfc4ce40fc2e8174d0164,32feed72947559e919bcfc4ce40fc2e8174d0164_37,Q3_2020_Valero_Energy_Corp_Earnings_Call_37,37,presentation,"Charles, which is designed to increase renewable diesel production capacity by 400 million gallons per year to 675 million gallons per year is still expected to be completed in 2021.",,,,,,sentence-level event detection,2021-06-10_10:53:20,,earnings call transcript,various,Q3_2020_Valero_Energy_Corp_Earnings_Call
c61f89fc819d52ad7d47da45724ab4aef3e2809a,c61f89fc819d52ad7d47da45724ab4aef3e2809a,32feed72947559e919bcfc4ce40fc2e8174d0164,32feed72947559e919bcfc4ce40fc2e8174d0164,32feed72947559e919bcfc4ce40fc2e8174d0164_38,Q3_2020_Valero_Energy_Corp_Earnings_Call_38,38,presentation,"Diamond Green Diesel also continues to make progress on the advanced engineering review for a potential new 400 million gallons per year renewable diesel plant at our Port Arthur, Texas refinery.",,,,,,sentence-level event detection,2021-06-10_10:53:20,,earnings call transcript,various,Q3_2020_Valero_Energy_Corp_Earnings_Call
c61f89fc819d52ad7d47da45724ab4aef3e2809a,c61f89fc819d52ad7d47da45724ab4aef3e2809a,32feed72947559e919bcfc4ce40fc2e8174d0164,32feed72947559e919bcfc4ce40fc2e8174d0164,32feed72947559e919bcfc4ce40fc2e8174d0164_39,Q3_2020_Valero_Energy_Corp_Earnings_Call_39,39,presentation,"As we look ahead, we expect to see improvement in margins as product inventories approach the normal 5-year range.",,,,,,sentence-level event detection,2021-06-10_10:53:20,,earnings call transcript,various,Q3_2020_Valero_Energy_Corp_Earnings_Call
c61f89fc819d52ad7d47da45724ab4aef3e2809a,c61f89fc819d52ad7d47da45724ab4aef3e2809a,32feed72947559e919bcfc4ce40fc2e8174d0164,32feed72947559e919bcfc4ce40fc2e8174d0164,32feed72947559e919bcfc4ce40fc2e8174d0164_40,Q3_2020_Valero_Energy_Corp_Earnings_Call_40,40,presentation,U.S. gasoline inventory is already in the middle of the 5-year range.,,,,,,sentence-level event detection,2021-06-10_10:53:20,,earnings call transcript,various,Q3_2020_Valero_Energy_Corp_Earnings_Call
c61f89fc819d52ad7d47da45724ab4aef3e2809a,c61f89fc819d52ad7d47da45724ab4aef3e2809a,32feed72947559e919bcfc4ce40fc2e8174d0164,32feed72947559e919bcfc4ce40fc2e8174d0164,32feed72947559e919bcfc4ce40fc2e8174d0164_41,Q3_2020_Valero_Energy_Corp_Earnings_Call_41,41,presentation,"And although distillate inventory is higher than the 5-year range, it's been trending downwards in recent weeks.",,,,,,sentence-level event detection,2021-06-10_10:53:20,,earnings call transcript,various,Q3_2020_Valero_Energy_Corp_Earnings_Call
c61f89fc819d52ad7d47da45724ab4aef3e2809a,c61f89fc819d52ad7d47da45724ab4aef3e2809a,32feed72947559e919bcfc4ce40fc2e8174d0164,32feed72947559e919bcfc4ce40fc2e8174d0164,32feed72947559e919bcfc4ce40fc2e8174d0164_42,Q3_2020_Valero_Energy_Corp_Earnings_Call_42,42,presentation,"Diesel demand should continue to improve, supported by winter heating oil demand and harvest season.",,,,,,sentence-level event detection,2021-06-10_10:53:20,,earnings call transcript,various,Q3_2020_Valero_Energy_Corp_Earnings_Call
c61f89fc819d52ad7d47da45724ab4aef3e2809a,c61f89fc819d52ad7d47da45724ab4aef3e2809a,32feed72947559e919bcfc4ce40fc2e8174d0164,32feed72947559e919bcfc4ce40fc2e8174d0164,32feed72947559e919bcfc4ce40fc2e8174d0164_43,Q3_2020_Valero_Energy_Corp_Earnings_Call_43,43,presentation,"Fall refinery turnarounds, coupled with recently announced and anticipated closures or conversions of less advantaged refineries, should also further balance supply.",,,,,,sentence-level event detection,2021-06-10_10:53:20,,earnings call transcript,various,Q3_2020_Valero_Energy_Corp_Earnings_Call
c61f89fc819d52ad7d47da45724ab4aef3e2809a,c61f89fc819d52ad7d47da45724ab4aef3e2809a,32feed72947559e919bcfc4ce40fc2e8174d0164,32feed72947559e919bcfc4ce40fc2e8174d0164,32feed72947559e919bcfc4ce40fc2e8174d0164_44,Q3_2020_Valero_Energy_Corp_Earnings_Call_44,44,presentation,"Although there's a lot of uncertainty in the market, we remain steadfast in the execution of our strategy, pursuing excellence in operations, investing in earnings growth with lower volatility and honoring our commitment to stockholder returns.",,,,,,sentence-level event detection,2021-06-10_10:53:20,,earnings call transcript,various,Q3_2020_Valero_Energy_Corp_Earnings_Call
c61f89fc819d52ad7d47da45724ab4aef3e2809a,c61f89fc819d52ad7d47da45724ab4aef3e2809a,32feed72947559e919bcfc4ce40fc2e8174d0164,32feed72947559e919bcfc4ce40fc2e8174d0164,32feed72947559e919bcfc4ce40fc2e8174d0164_45,Q3_2020_Valero_Energy_Corp_Earnings_Call_45,45,presentation,"Our unmatched execution, while being the lowest-cost producer and ample liquidity, position us well to manage this pandemic-induced low-margin environment and maintain our position of strength as the global economy recovers.",,,,,,sentence-level event detection,2021-06-10_10:53:20,,earnings call transcript,various,Q3_2020_Valero_Energy_Corp_Earnings_Call
c61f89fc819d52ad7d47da45724ab4aef3e2809a,c61f89fc819d52ad7d47da45724ab4aef3e2809a,32feed72947559e919bcfc4ce40fc2e8174d0164,32feed72947559e919bcfc4ce40fc2e8174d0164,32feed72947559e919bcfc4ce40fc2e8174d0164_46,Q3_2020_Valero_Energy_Corp_Earnings_Call_46,46,presentation,"Lastly, the guiding principles underpinning our capital allocation strategy remain unchanged.",,,,,,sentence-level event detection,2021-06-10_10:53:20,,earnings call transcript,various,Q3_2020_Valero_Energy_Corp_Earnings_Call
c61f89fc819d52ad7d47da45724ab4aef3e2809a,c61f89fc819d52ad7d47da45724ab4aef3e2809a,32feed72947559e919bcfc4ce40fc2e8174d0164,32feed72947559e919bcfc4ce40fc2e8174d0164,32feed72947559e919bcfc4ce40fc2e8174d0164_47,Q3_2020_Valero_Energy_Corp_Earnings_Call_47,47,presentation,"There is absolutely no change in our strategy, which prioritizes our investment-grade ratings, sustaining investments and honoring the dividend.",,,,,,sentence-level event detection,2021-06-10_10:53:20,,earnings call transcript,various,Q3_2020_Valero_Energy_Corp_Earnings_Call
c61f89fc819d52ad7d47da45724ab4aef3e2809a,c61f89fc819d52ad7d47da45724ab4aef3e2809a,32feed72947559e919bcfc4ce40fc2e8174d0164,32feed72947559e919bcfc4ce40fc2e8174d0164,32feed72947559e919bcfc4ce40fc2e8174d0164_48,Q3_2020_Valero_Energy_Corp_Earnings_Call_48,48,presentation,"So with that, Homer, I'll hand the call back to you.",,,,,,sentence-level event detection,2021-06-10_10:53:20,,earnings call transcript,various,Q3_2020_Valero_Energy_Corp_Earnings_Call
